Peperomia macrostachya 	-	-	-	-	-	-	Fruits basely attached, cylindrical, verruculose, brown,      	cylindric	0	-	brown	apex obliquely scutellate with subapical stigma.	-	-	0	-	-	-	-	-	-	-	-	-	-	-	-	Epiphytic herb, often growing on ants' nests, creeping or hanging and rooting at nodes. 	-	creeping	-	-	-	-	-	-	-	-	Inflorescence |, few together; 	0	-	-	-	0	-	-	-	-	0	-	-	-	-	floral bracts rounded, dentate or fimbriate, glandular. 	rounded	dentate	-	-	-	-	-	-	-	-	-	pendent	-	-	-	-	-	peduncle not slender, |, glabrous or minutely pubescent or papillose, red or brown; 	glabrous,minutely pubescent	red ,brown	to 1.5(-3) cm long	56	56	-	-	-	spike |, yellow to green, densely flowered; 	-	-	yellow,green,red;	-	-	to 30 cm long	-	-	-	-	-	0	-	-	0	-	-	-	-	-	-	-	-	-	-	-	-	-	-	-	-	-	-	-	-	-	-	-	-	-	-	-	Leaves alternate, basely attached;      	blade |, more or less ciliate, 	-	-	-	apex acute or acuminate, 	acute,acuminate	-	base rounded or cordulate or acutish, glabrous or slightly pubescent, a waxy exudate like small scales or stars is usually present on upper surface; 	rounded	glabrous,pubescent	-	-	-	-	4-11 x 1.5-6 cm	-	-	-	narrowly elliptic to ovate	narrowly elliptic,ovate	fleshy-coriaceous or subcoriaceous	fleshy,coriaceous,subcoriaceous	-	-	petiole |, glabrous, ciliate or puberulent, reddish; 	0	glabrous,puberulent	reddish;	0.5-2 cm long	-	-	-	-	venation obsolete, 7-9-pli-veined. 	0	-	-	-	-	-	-	-	-	-	-	-	-	-	-	-	-	-	-	-	-	-	-	-	-	-	-	-	-	-	-	-	-	-	-	-	-	-	-	-	-	-	-	-	0	-	-	-	-	-	-	-	-	-	-	Stem glabrous, |, green or green with red nodes. 	-	glabrous	-	green,green,red 	-	-	-	to 100 cm long	-	-	-	-	-	-	-	-	-	-	-	-	-	-	-	-	-	-	-	-	in wet forest, 	from sea level to 1800 m	
Peperomia magnoliifolia 	-	-	-	-	-	-	Fruits basely attached, subglobose, verruculose, reddish brown or blackish, gradually tapering into beak, which is slightly hooked at the very tip,      	subglobose	0	-	reddish ,brown	-	-	-	0	-	-	-	-	-	stigma at base of beak.	-	-	-	-	-	-	Epiphytic, epilithic or terrestrial herb. 	-	-	-	-	-	-	-	-	-	-	Inflorescence |, solitary or usually 2(-few) together; 	0	-	-	-	0	-	-	-	-	0	-	-	-	-	floral bracts rounded, |, glabrous, glandular. 	rounded	-	glabrous	-	5-7 mm in diam.	-	-	-	-	-	-	erect	-	-	-	-	-	peduncle slender (when dried) or not slender, |, glabrous, green or pinkish; 	glabrous	green,pinkish	1-8 cm long	56	56	-	-	-	spike |, green, white or yellow, densely flowered; 	-	-	green,white,yellow,red;	-	-	to 18 cm long	-	-	-	-	-	0	-	-	0	-	-	-	-	-	-	-	-	-	-	-	-	-	-	-	-	-	-	-	-	-	-	-	-	-	-	-	Leaves alternate, basely attached;      	blade |, often red-dotted, |, 	-	-	red-	apex rounded, obtuse occasionally slightly emarginate to acutish, 	rounded,obtuse	-	base cuneately decurrent into petiole, sometimes abruptly contracted, glabrous; 	cuneate	glabrous	-	-	-	-	4.5-14 x 2.5-6 cm	-	-	-	obovate or elliptic, sometimes even broadly elliptic	obovate,elliptic,broadly elliptic	fleshy	fleshy	-	-	petiole |, more or less laterally winged or grooved, glabrous; 	23	glabrous	-	1-7 cm long	-	-	-	-	venation obvious, ca. 7-pli-veined, or a few veins branching off primary vein or obsolete when dried. 	0	-	-	-	-	-	-	-	-	-	-	-	-	-	-	-	-	-	-	-	-	-	-	-	-	-	-	-	-	-	-	-	-	-	-	-	-	-	-	-	-	-	-	-	0	-	-	-	-	-	-	-	-	-	-	Stem erect, creeping or ascending, rooting at nodes, |, glabrous, green or green with red spots. 	-	glabrous	erect,creeping	green,green,red 	-	-	-	10-50 cm long	-	-	-	-	-	-	-	-	-	-	-	-	-	-	-	-	-	-	-	-	-	from sea level to over 1200 m	
Peperomia maguirei 	-	-	-	-	-	-	Fruits not sunken, subbasely attached, globose, green,      	globose	0	-	green	apex with short, thick style and apical stigma.	thick	-	0	-	-	-	-	-	-	-	-	-	-	-	-	Epiphytic or epilithic herb, erect or ascending from prostrate, rooting base. 	-	erect	-	-	-	-	-	-	-	-	Inflorescence solitary, 	0	-	-	-	0	-	-	-	-	0	-	-	-	-	floral bracts rounded, with scariose margin, glabrous, glandular. 	rounded	-	glabrous	-	-	-	-	-	-	-	-	erect	-	-	-	-	-	peduncle |, villous, green or reddish brown; 	villous	green,reddish ,brown	1-2 cm long	56	56	-	-	-	spike |, green, densely flowered, 	-	-	green,red,	-	-	2-7 cm long	rachis hardly ridged; 	-	-	-	-	0	-	-	0	-	-	-	-	-	-	-	-	-	-	-	-	-	-	-	-	-	-	-	-	-	-	-	-	-	-	-	Leaves in whorls of 1-4, basely attached;      	blade |, sometimes pink below, |, 	-	-	pink	apex rounded to emarginate, 	rounded	-	base acute, glabrous or loosely villous on upper surface, glabrescent, glabrous below; 	acute	glabrous,villous,glabrescent,glabrous	-	-	-	-	1-3.5 x 0.6-2.3 cm	margin not ciliate, 	-	-	obovate or somewhat elliptic	obovate,somewhat elliptic	fleshy coriaceous	fleshy,coriaceous	-	-	petiole |, loosely villous; 	0	villous	-	0.2-0.6 cm long	-	-	-	-	veins 3, obvious. 	0	-	-	-	-	-	-	-	-	-	-	-	-	-	-	-	-	-	-	-	-	-	-	-	-	-	-	-	-	-	-	-	-	-	-	-	-	-	-	-	-	-	-	-	0	-	-	-	-	-	-	-	-	-	-	Stem loosely villous, |, green or reddish brown. 	-	villous	-	green,reddish ,brown	-	-	-	10 cm long when fruiting	-	-	-	-	-	-	-	-	-	-	-	-	-	-	-	-	-	-	-	-	-	up to 700 m	
Peperomia obtusifolia 	-	-	-	-	-	-	Fruits basely attached, ellipsoid, verruculose, reddish brown or blackish,      	ellipsoid	0	-	reddish ,brown	apex abruptly contracted into slender beak, which is curved or curled at tip, 	-	-	0	-	-	-	-	-	stigma at base of beak.	-	-	-	-	-	-	Epiphytic, epilithic or terrestrial herb. 	-	-	-	-	-	-	-	-	-	-	Inflorescence |, solitary or few together; 	0	-	-	-	0	-	-	-	-	0	-	-	-	-	floral bracts rounded, |, glabrous, glandular. 	rounded	-	glabrous	-	2-4 mm in diam.	-	-	-	-	-	-	-	-	-	-	-	-	both the common peduncle and those of individual spikes bracteate, green or pinkish, slender (when dried) or not slender, together |, usually minutely pubescent; 	minutely pubescent	green,pinkish	1-14 cm long	56	56	-	-	-	spikes |, greenish white to yellow, densely flowered; 	-	-	greenish,white,yellow,red;	-	-	to 18 cm long	-	-	-	-	-	0	-	-	0	-	-	-	-	-	-	-	-	-	-	-	-	-	-	-	-	-	-	-	-	-	-	-	-	-	-	-	Leaves alternate, basely attached;      	blade shiny green, pale green below, |, often with red spots, |, 	-	-	green,pale green,red 	apex rounded, obtuse or emarginate, 	rounded,obtuse	-	base cuneate, glabrous; 	cuneate	glabrous	-	-	-	-	4-14.5 x 2.5-6.5 cm	-	-	-	elliptic, obovate or subspathulate	elliptic,obovate,subspathulate	coriaceous	coriaceous	-	-	petiole green or green with red spots, |, more or less grooved, minutely pubescent; 	0	minutely pubescent	green,green,red 	1-6.5 cm long	-	-	-	-	venation obvious or hardly visible, ca, 7-pli-veined, or few veins branching off primary vein. 	0	-	-	-	-	-	-	-	-	-	-	-	-	-	-	-	-	-	-	-	-	-	-	-	-	-	-	-	-	-	-	-	-	-	-	-	-	-	-	-	-	-	-	-	0	-	-	-	-	-	-	-	-	-	-	Stem erect, creeping or ascending, rooting at nodes, glabrous, green or green with red spots. 	-	glabrous	erect,creeping	green,green,red 	-	-	-	-	-	-	-	-	-	-	-	-	-	-	-	-	-	-	-	-	-	-	-	-	-	from sea level to over 1200 m	
Peperomia ouabianae 	-	-	-	-	-	-	Fruits sessile, ovoid, brown, somewhat verruculose,      	ovoid	0	-	brown	apex oblique with subapical stigma.	-	-	0	-	-	-	-	-	-	-	-	-	-	-	-	Epiphytic or epilithic herb, creeping and rooting at nodes. 	-	creeping	-	-	-	-	-	-	-	-	Inflorescence |, solitary; 	0	-	-	-	0	-	-	-	-	0	-	-	-	-	floral bracts rounded, glabrous, glandular. 	rounded	-	glabrous	-	-	-	-	-	-	-	-	-	-	-	-	-	-	peduncle slender, |, glabrous or minutely pubescent, green; 	glabrous,minutely pubescent	green	to 1.5 cm long	56	56	-	-	-	spike |, sparsely to densely flowered; 	-	-	red;	-	-	1.5-5.5 cm long	-	-	-	-	-	0	-	-	0	-	-	-	-	-	-	-	-	-	-	-	-	-	-	-	-	-	-	-	-	-	-	-	-	-	-	-	Leaves alternate;      	blade glandular-dotted, 	-	-	-	apex obtuse, 	obtuse	-	base acute to obtuse, sparsely to densely villous above, less so beneath, or glabrescent; 	acute,obtuse	densely villous,glabrescent	-	-	-	-	0.5-2 x 0.3-0.9 cm	margin ciliate, 	-	-	oblong-elliptic or oblong-obovate or almost orbicular	oblong,elliptic,oblong,obovate,orbicular	-	-	-	-	petiole |, loosely villous; 	0	villous	-	to 0.5 cm long	-	-	-	-	venation obvious, palmately 3-veined. 	0	-	-	-	-	-	-	-	-	-	-	-	-	-	-	-	-	-	-	-	-	-	-	-	-	-	-	-	-	-	-	-	-	-	-	-	-	-	-	-	-	-	-	-	0	-	-	-	-	-	-	-	-	-	-	Stem loosely villous, |, green to reddish. 	-	villous	-	green,reddish.	-	-	-	3-8 cm long	-	-	-	-	-	-	-	-	-	-	-	-	-	-	-	-	-	-	-	-	from sea level 	to 850-1400 m	
Peperomia pellucida 	-	-	-	-	-	-	Fruits somewhat stipitate, globose, brown (young, green ones may be finely longitudinally ridged),      	globose	0	-	brown,green	-	-	-	0	-	-	-	-	-	stigma apical, a short style may be developed.	-	-	-	-	-	-	Terrestrial herb, delicate, erect, glabrous, annual. 	glabrous	erect	-	-	-	-	-	-	-	-	Inflorescence |, solitary; 	0	-	-	-	0	-	-	-	-	0	-	-	-	-	floral bracts rounded, glabrous, minutely glandular. 	rounded	-	glabrous	-	-	-	-	-	densely flowered; 	red;	-	-	-	-	-	-	-	peduncle slender, |, green; 	-	green	to 1 cm long	56	56	-	-	-	spike 	-	-	-	-	-	1-6 cm long	-	-	-	-	-	0	-	-	0	-	-	-	-	-	-	-	-	-	-	-	-	-	-	-	-	-	-	-	-	-	-	-	-	-	-	-	Leaves alternate, basely attached;      	blade 	-	-	-	apex acute to obtuse, 	acute,obtuse	-	base rounded, cordulate or truncate; 	rounded,truncate	-	-	-	-	-	1-3.7(-5) x 1-3.5(-5.5) cm	-	-	-	broadly elliptic to deltoid	broadly elliptic,deltoid	membranous, often drying translucent	membranous	-	-	petiole |, glabrous; 	0	glabrous	-	to 0.3-2.5 cm long	-	-	-	-	palmately 5-7-veined. 	0	-	-	-	-	-	-	-	-	-	-	-	-	-	-	-	-	-	-	-	-	-	-	-	-	-	-	-	-	-	-	-	-	-	-	-	-	-	-	-	-	-	-	-	0	-	-	-	-	-	-	-	-	-	-	Stem |, green often reddish tinged. 	-	-	-	green,reddish 	-	-	-	10-30(-40) cm long	-	-	-	-	-	-	-	-	-	-	-	-	-	-	-	-	-	-	-	-	-	-	
Peperomia pernambucensis 	-	-	-	-	-	-	Fruits basely attached, cylindrical, slightly verrucose,      	cylindric	0	-	-	apex truncate with central stigma.	-	truncate	0	-	-	-	-	-	-	-	-	-	-	-	-	Terrestrial or epiphytic, erect herb, glabrous except for pubescent peduncle. 	glabrous,pubescent	erect	-	-	-	-	-	-	-	-	Inflorescence |, paniculate; 	0	-	-	-	0	-	-	-	-	0	-	-	-	-	floral bracts rounded, glabrous, glandular. 	rounded	-	glabrous	-	-	-	-	-	-	-	-	-	-	-	-	-	-	peduncle |, densely velvety pubescent, green; 	pubescent	green	5 cm long	56	56	-	-	-	spikes |, green, densely flowered; 	-	-	green,red;	-	-	4-8 cm long	-	-	-	-	-	0	-	-	0	-	-	-	-	-	-	-	-	-	-	-	-	-	-	-	-	-	-	-	-	-	-	-	-	-	-	-	Leaves alternate, basely attached;      	blade 	-	-	-	apex acuminate, 	acuminate	-	base cuneate; 	cuneate	-	-	-	-	-	15-30 x 4-12 cm	-	-	-	narrowly elliptic or oblanceolate	narrowly elliptic,oblanceolate	membranous	membranous	-	-	petiole to 	0	-	-	0.25 cm long	-	-	-	-	venation pinnate with 4-5(-8) lateral pairs of veins. 	23	-	-	-	-	-	-	-	-	-	-	-	-	-	-	-	-	-	-	-	-	-	-	-	-	-	-	-	-	-	-	-	-	-	-	-	-	-	-	-	-	-	-	-	0	-	-	-	-	-	-	-	-	-	-	Stem |, green. 	-	-	-	green	-	-	-	to 5 cm long	-	-	-	-	-	-	-	-	-	-	-	-	-	-	-	-	-	-	-	-	-	to 700 m	
Peperomia popayanensis 	-	-	-	-	-	-	Fruits basely attached, ellipsoid,      	ellipsoid	0	-	-	apex with slender beak and stigma at base of beak.	-	-	0	-	-	-	-	-	-	-	-	-	-	-	-	Terrestrial, ascending, almost glabrous herb, rooting at nodes. 	glabrous	-	-	-	-	-	-	-	-	-	Inflorescence |, solitary; 	0	-	-	-	0	-	-	-	-	0	-	-	-	-	floral bracts, rounded, glabrous. 	rounded	-	glabrous	-	-	-	-	-	-	-	-	-	-	-	-	-	-	peduncle slender, |, with 2-3 caducous bracts, green; 	-	green	3-7 cm long	1	1	-	-	-	spike |, green; 	-	-	green	-	-	17 cm long	-	-	-	-	-	0	-	-	0	-	-	-	-	-	-	-	-	-	-	-	-	-	-	-	-	-	-	-	-	-	-	-	-	-	-	-	Leaves alternate, slightly subpeltate;      	blade 	-	-	-	apex acuminate, 	acuminate	-	base rounded to cordulate, minutely ciliate towards apex; 	rounded	-	-	-	-	-	to 12 x 7 cm	-	-	-	ovate	ovate	coriaceous	coriaceous	-	-	petiole 	0	-	-	to 20 cm long	-	-	-	-	somewhat pli-veined with 2 pairs at base and 2-3 pairs from primary vein. 	0	-	-	-	-	-	-	-	-	-	-	-	-	-	-	-	-	-	-	-	-	-	-	-	-	-	-	-	-	-	-	-	-	-	-	-	-	-	-	-	-	-	-	-	0	-	-	-	-	-	-	-	-	-	-	Stem glabrous, green. 	-	glabrous	-	green	-	-	-	-	-	-	-	-	-	-	-	-	-	-	-	-	-	-	-	-	-	-	-	-	-	-	
Peperomia purpurinervis 	-	-	-	-	-	-	Fruits basely attached, ovoid to globose, smooth,      	ovoid,globose	0	-	-	-	-	-	0	-	-	-	-	-	stigma apical.	-	-	-	-	-	-	Epiphytic, terrestrial or epilithic herb, creeping to ascending. 	-	creeping	-	-	-	-	-	-	-	-	Inflorescence |, solitary; 	0	-	-	-	0	-	-	-	-	0	-	-	-	-	floral bracts rounded, glabrous, glandular. 	rounded	-	glabrous	-	-	-	-	-	-	-	-	-	-	-	-	-	-	peduncle not slender, |, glabrous or minutely pubescent; 	glabrous,minutely pubescent	-	0.5-2.5 cm long	56	56	-	-	-	spike erect, |, yellow or pale green or greenish white, laxly flowered; 	-	erect	yellow,pale green,greenish,white,red;	-	-	5-7 cm long	-	-	-	-	-	0	-	-	0	-	-	-	-	-	-	-	-	-	-	-	-	-	-	-	-	-	-	-	-	-	-	-	-	-	-	-	Leaves alternate, basely attached;      	blade |, maybe sparsely ciliate, 	-	-	-	apex acute to obtuse, 	acute,obtuse	-	base acute or obtuse, glabrous or slightly hirtellous, green above, often magenta-red below; 	acute,obtuse	glabrous	-	green,magenta,red 	-	-	1-3.5 x 0.8-2.3 cm	-	-	-	elliptic, subobovate or broadly ovate	elliptic,subobovate,broadly ovate	fleshy-coriaceous	fleshy,coriaceous	-	-	petiole 	0	-	-	0.2-1 cm long	-	-	-	-	veins 3, obvious, often red below. 	0	red 	-	-	-	-	-	-	-	-	-	-	-	-	-	-	-	-	-	-	-	-	-	-	-	-	-	-	-	-	-	-	-	-	-	-	-	-	-	-	-	-	-	-	0	-	-	-	-	-	-	-	-	-	-	Stem glabrous to minutely pubescent (with white hairs, Persaud 52), |, reddish. 	-	glabrous,minutely pubescent,hairs	-	white,reddish.	-	-	-	10-28 cm long	-	-	-	-	-	-	-	-	-	-	-	-	-	-	-	-	-	-	-	-	in dense forest on sandstone, 	1120-2750 m	
Peperomia quadrangularis 	-	-	-	-	-	-	Fruits somewhat sunken when young, slightly stipitate when ripe, ovoid, smooth and shiny (in vivo) brown, upper half often grayish, verruculose or papillate, with apical stigma.	ovoid	0	-	brown	-	-	-	0	-	-	-	-	-	-	-	-	-	-	-	-	Epiphytic or epilithic herb, creeping or hanging, sometimes mat-forming. 	-	creeping	-	-	-	-	-	-	-	-	Inflorescence |, solitary or two together, 	0	-	-	-	0	-	-	-	-	0	-	-	-	-	floral bracts rounded or oblong, glabrous, glandular; 	rounded,oblong	-	glabrous	-	-	-	-	-	-	-	-	erect	-	-	-	-	-	peduncle not slender, |, pubescent, 2-bracteate, red, brownish or green; 	pubescent	red,,brownish,green	0.5-4 cm long	56	1	rachis strongly ridged (at least when dried). 	-	-	spike |, green or yellow-green, laxly to moderately flowered; 	-	-	green,yellow,green,red;	-	-	up to 6 cm long	-	-	-	-	-	0	-	-	0	-	-	-	-	-	-	-	-	-	-	-	-	-	-	-	-	-	-	-	-	-	-	-	-	-	-	-	Leaves opposite, basely attached;      	blade 	-	-	-	apex obtuse, rounded or slightly acute, 	obtuse,rounded,acute	-	base acute to rounded, dark green above, with paler veins beneath, minutely puberulent above, sparsely so and glabrescent beneath; 	acute,rounded	minutely puberulent,glabrescent	-	dark green	-	-	1-4.5 x 0.8-2.2(-2.7) cm	margin ciliate, 	-	-	broadly elliptic, obovate or orbicular	broadly elliptic,obovate,orbicular	fleshy coriaceous	fleshy,coriaceous	-	-	petiole |, glabrous or minutely pubescent; 	0	glabrous,minutely pubescent	-	0.1-0.5 cm long	-	-	-	-	palmately 3-veined, veins impressed above, prominent beneath. 	0	-	-	-	-	-	-	-	-	-	-	-	-	-	-	-	-	-	-	-	-	-	-	-	-	-	-	-	-	-	-	-	-	-	-	-	-	-	-	-	-	-	-	-	0	-	-	-	-	-	-	-	-	-	-	Stem quadrangular, minutely pubescent,      	-	minutely pubescent	-	-	internodes |, green brownish or reddish. 	green,brownish,reddish.	2-6 cm long	-	-	-	-	-	-	-	-	-	-	-	-	-	-	-	-	-	-	-	-	-	in savanna forest, 	up to 200 m	
Peperomia quadrifolia 	-	-	-	-	-	-	Fruits basely attached, ovoid or subglobose, brown,      	ovoid,subglobose	0	-	brown	apex attenuate or somewhat stylose, 	-	-	0	-	-	-	-	-	stigma apical.	-	-	-	-	-	-	Epiphytic, trailing, glabrous herb. 	glabrous	-	-	-	-	-	-	-	-	-	Inflorescence |, solitary, 	0	-	-	-	0	-	-	-	-	0	-	-	-	-	floral bracts rounded, glabrous and sparsely glandular. 	rounded	-	glabrous	-	-	-	-	-	-	-	-	erect	-	-	-	-	-	peduncle not slender, |, green; 	-	green	up to 1.7 cm long	56	56	-	-	-	spike |, densely flowered, green; 	-	-	red,,green	-	-	1-3.5 (according to Henkel 946, to 10) cm long	-	-	-	-	-	0	-	-	0	-	-	-	-	-	-	-	-	-	-	-	-	-	-	-	-	-	-	-	-	-	-	-	-	-	-	-	Leaves in whorls of 3-6, usually 4, basely attached;      	blade 	-	-	-	apex emarginate, occasionally with hairs in indentation, 	-	hairs	base acute; 	acute	-	-	-	-	-	0.6-1.8 x 0.4-1.0 cm	-	-	-	subspathulate, or elliptic-, or oblong-obovate	subspathulate,elliptic,oblong,obovate	fleshy-coriaceous	fleshy,coriaceous	-	-	petiole 	0	-	-	0.1-0.4 cm long	-	-	-	-	palmately 3-veined. 	0	-	-	-	-	-	-	-	-	-	-	-	-	-	-	-	-	-	-	-	-	-	-	-	-	-	-	-	-	-	-	-	-	-	-	-	-	-	-	-	-	-	-	-	0	-	-	-	-	-	-	-	-	-	-	Stem erect to ascending, glabrous, |, green or reddish. 	-	glabrous	erect	green,reddish.	-	-	-	up to 25 cm long	-	-	-	-	-	-	-	-	-	-	-	-	-	-	-	-	-	-	-	-	from 	1000-2800 m	
Peperomia reptans 	-	-	-	-	-	-	Fruits basely attached, subglobose to ovoid, with more or less hooked beak and subapical stigma.	subglobose,ovoid	0	-	-	-	-	-	0	-	-	-	-	-	-	-	-	-	-	-	-	Epiphytic, terrestrial or epilithic herb, creeping. 	-	creeping	-	-	-	-	-	-	-	-	Inflorescence single, 	0	-	-	-	0	-	-	-	-	0	-	-	-	-	floral bracts rounded, glandular. 	rounded	-	-	-	-	-	-	-	-	-	-	-	-	-	-	-	-	peduncle not slender, often bracteate, |, longer than spike, pubescent, sometimes red; 	pubescent	red;	3-6 cm long	1	1	-	-	-	spike |, green or yellow, densely flowered; 	-	-	green,yellow,red;	-	-	1-2.5 cm long	-	-	-	-	-	0	-	-	0	-	-	-	-	-	-	-	-	-	-	-	-	-	-	-	-	-	-	-	-	-	-	-	-	-	-	-	Leaves alternate, basely attached;      	blade |, dark green above, light green beneath, |, 	-	-	dark green,light green	apex acutely obtuse, 	acute,obtuse	-	base cordate, cordulate or rounded, brown appressed-pilose above, below light green (Tillett), red with green (Persaud) or brown (Hahn) stripes and white hairs (Persaud); 	cordate,rounded	appressed-pilose,hairs	-	brown,light green,red ,green,brown,white	-	-	0.8-2.5 x 0.8-2.5 cm	margin ciliate, 	-	-	broadly ovate to deltoid	broadly ovate,deltoid	fleshy, coriaceous	fleshy,coriaceous	-	-	petiole |, retrorsely appressed-pubescent; 	0	appressed-pubescent	-	1-1.5(-4.5) cm long	-	-	-	-	venation obvious in dried state, obsoletely palmately 5-7-veined. 	0	-	-	-	-	-	-	-	-	-	-	-	-	-	-	-	-	-	-	-	-	-	-	-	-	-	-	-	-	-	-	-	-	-	-	-	-	-	-	-	-	-	-	-	0	-	-	-	-	-	-	-	-	-	-	Stem succulent, glossy, retrorsely crisp-pubescent, green with red spots or reddish. 	-	pubescent	-	green,red ,reddish.	-	-	-	-	-	-	-	-	-	-	-	-	-	-	-	-	-	-	-	-	-	-	-	-	from 	300-1900 m	
Peperomia rhombea 	-	-	-	-	-	-	Fruits ellipsoid or ovoid, |, slightly stipitate at maturity, 	ellipsoid,ovoid	0	-	-	-	-	-	0	-	-	-	0.9-1 mm long	-	stigma apical.	-	-	-	-	-	-	Epiphytic, stoloniferous herb. 	-	-	-	-	-	-	-	-	-	-	Inflorescence |, solitary, simple; 	0	-	-	-	0	-	-	-	-	0	-	-	-	-	floral bracts rounded, glabrous, 	rounded	-	glabrous	-	0.4-0.5 mm in diam.	-	-	-	-	-	-	-	-	-	-	-	-	peduncle |, minutely pubescent; 	minutely pubescent	-	0.8-3.7 cm long	56	56	-	-	-	spike 	-	-	-	-	-	2.2-6 cm long	-	-	-	-	-	0	-	-	0	-	-	-	-	-	-	-	-	-	-	-	-	-	-	-	-	-	-	-	-	-	-	-	-	-	-	-	Leaves in whorls of 3-5, usually 4;      	blade 	-	-	-	-	-	-	-	-	-	-	-	-	-	1.3-1.5 x 0.4-1 cm	margin ciliolate at apex, obtuse at apex, narrowly acute at base, glabrous above, sparsely minutely pubescent below; 	obtuse,narrowly acute	glabrous,minutely pubescent	subrhombic, elliptic or narrowly elliptic	subrhombic,elliptic,narrowly elliptic	coriaceous fleshy	coriaceous,fleshy	-	-	petiole |, minutely pubescent; 	0	minutely pubescent	-	0.1-0.5 cm long	-	-	-	-	distinctly palmately 3-veined. 	0	-	-	-	-	-	-	-	-	-	-	-	-	-	-	-	-	-	-	-	-	-	-	-	-	-	-	-	-	-	-	-	-	-	-	-	-	-	-	-	-	-	-	-	0	-	-	-	-	-	-	-	-	-	-	Stem sparsely pubescent. 	-	sparsely pubescent	-	-	-	-	-	-	-	-	-	-	-	-	-	-	-	-	-	-	-	-	-	-	-	-	-	-	-	-	
Peperomia rotundifolia 	-	-	-	-	-	-	Fruits (sub)basely attached, globose to ovoid, brown, reticulately verruculose,      	globose,ovoid	0	-	brown	apex oblique with subapical stigma.	-	-	0	-	-	-	-	-	-	-	-	-	-	-	-	Epiphytic or epilithic herb, prostrate with ascending stem tips rooting at nodes. 	-	-	-	-	-	-	-	-	-	-	Inflorescence |, solitary; 	0	-	-	-	0	-	-	-	-	0	-	-	-	-	floral bracts rounded, glabrous, glandular. 	rounded	-	glabrous	-	-	-	-	-	-	-	-	-	-	-	-	-	-	peduncle not nodose, without bract, |, pubescent or glabrous; 	pubescent,glabrous	-	up to 1 cm long	56	56	-	-	-	spike |, yellow to red, moderately to densely flowered; 	-	-	yellow,red,,red;	-	-	2-6 cm long	-	-	-	-	-	0	-	-	0	-	-	-	-	-	-	-	-	-	-	-	-	-	-	-	-	-	-	-	-	-	-	-	-	-	-	-	Leaves alternate, basely attached, sometimes subpeltate,      	blades 	-	-	-	apex rounded, 	rounded	-	base rounded, glabrous to puberulent; 	rounded	glabrous,puberulent	-	-	-	-	(0.5-)1-1.2 x (0.5-)1-1.2 cm	margin ciliate, 	-	-	broadly elliptic to elliptic or almost orbicular	broadly elliptic,elliptic,orbicular	fleshy or fleshy coriaceous	fleshy,fleshy,coriaceous	-	fertile branches often with distally progressively smaller leaves; 	petiole |, pubescent to glabrous; 	0	pubescent,glabrous	-	up to 1 cm long	-	-	-	-	obsolete palmately 3-veined. 	0	-	-	-	-	-	-	-	-	-	-	-	-	-	-	-	-	-	-	-	-	-	-	-	-	-	-	-	-	-	-	-	-	-	-	-	-	-	-	-	-	-	-	-	0	-	-	-	-	-	-	-	-	-	-	Stem crisp-pubescent when young,      	-	pubescent	-	-	internodes |, green often with red spots. 	green,red 	0.3-2 cm long	-	-	-	-	-	-	-	-	-	-	-	-	-	-	-	-	-	-	-	-	-	humid forests 	from sea level up to 1000 m	
Peperomia serpens 	-	-	-	-	-	-	Fruits basely attached, ellipsoid, brown,      	ellipsoid	0	-	brown	apex with slender beak and subapical stigma.	-	-	0	-	-	-	-	-	-	-	-	-	-	-	-	Epiphytic or epilithic herb, creeping or twining and rooting at nodes. 	-	creeping	-	-	-	-	-	-	-	-	Inflorescence |, solitary; 	0	-	-	-	0	-	-	-	-	0	-	-	-	-	floral bracts rounded, glabrous, glandular. 	rounded	-	glabrous	-	-	-	-	-	-	-	-	-	-	-	-	-	-	peduncle nodose or with 1-2 caducous bracts, not slender, |, crisp-pubescent, not winged, green; 	pubescent	green	to 3 cm long	56	56	-	-	-	spike |, pale green, densely flowered; 	-	-	pale green,red;	-	-	up to 1.7 cm long	-	-	-	-	-	0	-	-	0	-	-	-	-	-	-	-	-	-	-	-	-	-	-	-	-	-	-	-	-	-	-	-	-	-	-	-	Leaves alternate, slightly peltate;      	blade |, ciliolate towards apex, 	-	-	-	apex rounded, 	rounded	-	base rounded, some hairs on young leaves only; 	rounded	hairs	-	-	-	-	1-2 x 1-2 cm	-	-	-	broadly elliptic or deltoid	broadly elliptic,deltoid	fleshy or slightly coriaceous	fleshy,coriaceous	-	-	petiole |, crisp-pubescent; 	0	pubescent	-	to 2 cm long	-	-	-	-	venation obsoletely 3-5-veined. 	0	-	-	-	-	-	-	-	-	-	-	-	-	-	-	-	-	-	-	-	-	-	-	-	-	-	-	-	-	-	-	-	-	-	-	-	-	-	-	-	-	-	-	-	0	-	-	-	-	-	-	-	-	-	-	Stem minutely crisp-pubescent,      	-	pubescent	-	-	internodes |, green. 	green	0.5-3 cm long	-	-	-	-	-	-	-	-	-	-	-	-	-	-	-	-	-	-	-	-	-	-	from sea level to 1200 m	
Peperomia tenella 	-	-	-	-	-	-	Fruits slightly stipitate at maturity, ellipsoid to obpyriform, with short beak and apical stigma.	ellipsoid	0	-	-	-	-	-	0	-	-	-	-	-	-	-	-	-	-	-	-	Terrestrial, epilithic or epiphytic, not branched, tiny herb, decumbent and rooting at base,      	-	-	fertile stems erect. 	erect	-	-	-	-	-	-	Inflorescence |, solitary; 	0	-	-	-	0	-	-	-	-	0	-	-	-	-	floral bracts rounded to narrowly oblong, glabrous, glandular. 	rounded,narrowly oblong	-	glabrous	-	-	-	-	-	-	-	-	erect	-	-	-	-	-	peduncle not slender, |, glabrous, green; 	glabrous	green	0.4-1.5 cm long	56	56	-	-	-	spike |, green, flowers distinctly separate; 	-	-	green	-	-	1.7-4 cm long	-	-	-	-	-	0	-	-	0	-	-	-	-	-	-	-	-	-	-	-	-	-	-	-	-	-	-	-	-	-	-	-	-	-	-	-	Leaves alternate, basely attached;      	blade 	-	-	-	apex obtuse and minutely emarginate with hairs in indentation, 	obtuse	hairs	base acutish to obtuse, glabrous and ciliate, sometimes sparsely pilose; 	obtuse	glabrous,sparsely pilose	-	-	-	-	0.6-1.5 x 0.2-1.4 cm	-	-	-	elliptic or ovate	elliptic,ovate	fleshy-subcoriaceous	fleshy,subcoriaceous	-	-	petiole |, glabrous or with a few hairs at node; 	0	glabrous,hairs	-	0.1-0.5 cm long	-	-	-	-	obsoletely palmately 3-veined. 	0	-	-	-	-	-	-	-	-	-	-	-	-	-	-	-	-	-	-	-	-	-	-	-	-	-	-	-	-	-	-	-	-	-	-	-	-	-	-	-	-	-	-	-	0	-	-	-	-	-	-	-	-	-	-	Stem glabrous to somewhat minutely pubescent,      	-	glabrous,minutely pubescent	-	-	internodes |, green with lilac. 	green,lilac	0.2-1.6 cm long	-	-	-	-	-	-	-	-	-	-	-	-	-	-	-	-	-	-	-	-	-	in forests especially cloud forests, at 	high altitudes up to 1580 m	
Peperomia tetraphylla 	-	-	-	-	-	-	Fruits basely attached in depressions of rachis, narrowly ovoid to ellipsoid-subcylindrical,      	narrowly ovoid,ellipsoid,cylindric	0	-	-	apex with short beak and subapical stigma.	-	-	0	-	-	-	-	-	-	-	-	-	-	-	-	Epiphytic or rarely epilithic herb, cespitose or rooting at nodes and ascending. 	-	-	-	-	-	-	-	-	-	-	Inflorescence |, solitary; 	0	-	-	-	0	-	-	-	-	0	-	-	-	-	floral bracts rounded, glabrous, glandular. 	rounded	-	glabrous	-	-	-	-	-	-	-	-	-	-	-	-	-	-	peduncle |, minutely pubescent, green; 	minutely pubescent	green	to 2 cm long	56	56	rachis pubescent; 	pubescent	-	spike |, cream-white; 	-	-	white	-	-	up to 4 cm long	-	-	-	-	-	0	-	-	0	-	-	-	-	-	-	-	-	-	-	-	-	-	-	-	-	-	-	-	-	-	-	-	-	-	-	-	Leaves in whorls of 4, basely attached;      	blade 	-	-	-	apex obtuse, rounded or emarginate, 	obtuse,rounded	-	base obtuse to subacute, somewhat ciliate towards apex and sparsely puberulent to glabrous; 	obtuse,acute	sparsely puberulent,glabrous	-	-	-	-	0.6-1.2 x 0.4-1.0 cm	-	-	-	rhombic, ovate-elliptic to suborbicular	rhombic,ovate,elliptic,suborbicular	fleshy to subcoriaceous	fleshy,subcoriaceous	-	-	petiole |, minutely pubescent; 	0	minutely pubescent	-	0.05-0.2 cm long	-	-	-	-	obsoletely palmately 3-veined. 	0	-	-	-	-	-	-	-	-	-	-	-	-	-	-	-	-	-	-	-	-	-	-	-	-	-	-	-	-	-	-	-	-	-	-	-	-	-	-	-	-	-	-	-	0	-	-	-	-	-	-	-	-	-	-	Stem |, minutely pubescent, green. 	-	minutely pubescent	-	green	-	-	-	to 25 cm long	-	-	-	-	-	-	-	-	-	-	-	-	-	-	-	-	-	-	-	-	at higher altitudes.	-	
