Psittacanthus eucalyptifolius 	Flower bud |, strongly sigmoid, |, tip expanded |, rather blunt; |, opening for at least 3/4; |, 	-	-	ca. 3.5 cm long	-	-	-	-	-	-	-	-	-	-	-	-	-	-	-	-	Fruit |, with well developed calyculus.	well developed	-	-	-	-	-	1.2 x 0.8 cm	-	-	-	-	-	-	-	-	-	-	-	-	-	-	-	-	-	-	-	-	-	-	-	-	-	Innovations and inflorescence with craterlike scar, latter |, with short, wide, blunt bract; 	short,wide	-	-	-	-	-	-	-	-	-	-	-	-	inflorescence peduncle 	-	-	1.5-3 cm	axillary	-	axillary	-	ca. 1 cm	-	-	     	-	-	-	-	-	-	to 12 x 6 cm	broadly ovate to lanceolate	lanceolate,ovate	-	0.3-0.4 cm long	venation pinnate. 	-	-	-	-	-	-	-	-	-	-	-	-	-	-	-	-	-	-	-	-	-	
Psittacanthus grandifolius 	     	-	-	-	-	style as long as petals, 	-	-	-	-	-	-	-	-	-	-	-	-	-	-	Fruit 	-	-	-	black	-	black	1 x 0.6 cm	-	-	ovoid	ovoid	Rather large plants with terete stems. 	-	large,terete	-	-	-	-	-	-	-	-	-	-	-	-	-	-	-	-	-	-	Inflorescence |, mostly an umbel of |, ramifications |, 	-	-	-	-	-	-	-	-	-	-	-	-	-	inflorescence peduncle 	-	-	to 1 cm	axillary	-	axillary	-	-	-	-	-	-	-	-	-	-	-	-	-	-	-	-	-	-	Petiole stout, |, 	-	-	apex acute, sometimes attenuate, 	acute,attenuate	base obtuse to nearly truncate, 	obtuse,truncate	to 17 x 7 cm	-	ovate	ovate	leathery	leathery	0.2-0.6 cm long	venation pinnate, lower midrib very prominent. 	-	-	-	-	-	
Psittacanthus lasianthus 	Flower bud deep |, |, with conspicuous, smooth connectival horn |, long, 	-	smooth	4-4.5 cm long	-	style reaching tips of upper anthers,       	-	-	-	-	-	-	-	-	-	-	-	-	-	-	Fruit becoming 	-	-	-	black	-	black	1 x 0.8 cm	-	-	-	-	     	-	-	-	-	-	-	-	-	-	-	-	-	-	internodes short, 	short	-	1.5-3 cm long	-	-	-	Inflorescence an |, |, with conspicuous cupule; |, nearly glabrous; 	-	-	-	-	glabrous	-	calyculus entire. 	-	entire	-	-	-	-	peduncle of inflorescence and triad 	-	-	0.7-0.9 cm	axillary	-	axillary	-	-	-	-	-	-	-	-	-	-	-	-	-	-	-	-	-	-	Petiole massive, |, glaucous when young, 	-	-	-	-	-	-	to 8 x 5 cm	-	broadly ovate to nearly orbicular or somewhat spathulate	orbicular,ovate,spathulate	fleshy	fleshy	to 1 cm long	venation obscure. 	-	-	-	-	-	
Psittacanthus melinonii 	Flower bud straight and slender, |, of which |, with an indistinct neck |, inserted |, acicular, with 4 rows of minute locules dehiscing separately, anther back with numerous long, unbranched, 	acicular,dehiscing,minute,separate,slender,unbranched	-	ca. 7 cm long	-	style as long as flower bud,       	-	-	-	-	-	-	-	-	-	-	-	-	-	-	-	-	-	-	-	-	-	-	-	-	-	-	Medium sized plants, young stems glabrous, somewhat angular, becoming terete. 	-	angular,terete	glabrous	-	-	-	-	-	-	-	-	-	-	-	-	-	-	-	-	-	Inflorescence |, apparently on leafless older wood, consisting of |, |, slightly furfuraceous; 	-	-	-	-	-	-	-	-	-	-	-	-	-	inflorescence peduncle 	-	-	0.4 cm	axillary only?	-	axillary only?	a pair	-	-	-	     	-	-	-	-	-	-	to 10 x 5 cm	obovate	obovate	-	1-1.5 cm long	venation obscure but pinnate. 	-	-	-	-	-	-	-	-	-	-	-	-	-	-	-	-	-	-	-	-	-	
Psittacanthus peronopetalus 	Flower bud straight, |, dorsifixed in short sleeve of anther, and attached 	short	-	-	-	style more or less straight,       	-	-	-	-	-	-	-	-	-	-	-	-	-	-	Fruit 	-	-	-	deep red	-	red	1 x 0.5 cm	-	-	ellipsoid	ellipsoid	-	-	-	-	-	-	-	-	-	-	-	-	-	-	-	-	-	-	-	-	-	Inflorescence (mostly) |, often clustered near branch tips, each a frequently long-stalked raceme, |, |, entire; 	-	-	-	entire	-	-	calyculus irregularly crenate. 	-	crenate	regular	-	-	-	inflorescence peduncle 	-	-	to 3 cm long	lateral	-	lateral	ca. 4 pairs	-	-	-	     	-	-	-	-	apex somewhat attenuate, 	attenuate	to 15 x 6 cm	narrowly ovate	narrow,ovate	-	0.2-0.5 cm long	venation pinnate but inconspicuous. 	-	-	-	-	-	-	-	-	-	-	-	-	-	-	-	-	-	-	-	-	-	
Psittacanthus plagiophyllus 	Flower bud (minus ovary) |, straight, |, |, 	-	-	3 cm long	-	-	-	-	-	-	-	-	-	-	-	-	-	-	-	-	Fruit unknown.	-	-	-	-	-	-	-	-	-	-	-	-	-	-	-	-	-	-	-	-	-	-	-	-	-	-	-	-	-	-	-	-	Inflorescence in upper axils, especially crowded at stem tip, each an umbel of |, |, expanding into a cupule |, which is 	-	-	-	-	-	-	calyculus irregulary but not deeply torn. 	-	-	regular	-	-	-	inflorescence peduncle 	-	-	to 3 cm long	-	-	-	-	-	-	-	-	-	-	-	-	-	-	-	-	-	-	-	-	-	     	-	-	-	-	base of blade acutely tapering; 	acute	to 12 x 2 cm	-	-	-	stiff	stiff	-	venation rather obscure, pinnate. 	-	-	-	-	-	
Psittacanthus redactus 	Flower bud slender, without constrictions or dilations, |, gradually tapering to an acute apex; |, |, dorsifixed near the middle; 	acute,slender	-	-	-	style nearly as long as petals,       	-	-	-	-	-	-	-	-	-	-	-	-	-	-	Fruit unknown.	-	-	-	-	-	-	-	-	-	-	-	Medium-sized plant with fairly terete stems and 	-	terete	-	-	-	-	-	-	-	-	-	-	-	-	-	-	-	-	-	-	Inflorescence an umbel of 	-	-	-	-	-	-	calyculus more or less smooth. 	smooth	-	-	-	-	-	inflorescence peduncle 	-	-	-	-	-	-	-	-	-	-	Leaves decussate but members of a pair frequently separated |, small axillary corky craters present; |, 	separate,small	axillary	-	-	apex blunt to slightly apiculate, 	apiculate	to 11 x 4 cm	lanceolate to slightly obovate	lanceolate,obovate	-	at least 0.5 cm long	pinnate venation evident especially above. 	-	-	-	-	-	-	-	-	-	-	-	-	-	-	-	-	-	-	-	-	-	
Psittacanthus robustus 	Flower bud |, straight and slender to very slightly arched, |, narrowing to nearly half that, the |, almost filiform, |, implanted |, rounded at both ends.	filiform,narrow,rounded,slender	-	to 8 cm long	-	-	-	-	-	-	-	-	-	-	-	-	-	-	-	-	-	-	-	-	-	-	-	-	-	-	-	-	Large, glabrous plants, stems somewhat angular when young, becoming terete. 	-	angular,terete	glabrous	-	-	-	-	-	-	-	-	-	-	-	-	-	-	-	-	-	Inflorescence crowded |, each an umbel of |, |, shallowly and irregularly dentate. 	-	-	-	dentate	-	regular	calyculus 	-	-	-	-	-	-	inflorescence peduncle 	-	-	to 6 cm	in uppermost leaf axils, not terminal	-	terminal	-	-	-	-	Leaves 	-	-	-	-	-	-	-	-	-	-	-	venation obscure. 	-	-	-	-	-	-	-	-	-	-	-	-	-	-	-	-	-	-	-	-	-	
STRUTHANTHUS  	-	-	-	-	-	-	-	Flowers |, inconspicuous and small, 	small	-	-	-	usually greenish white	green,white	-	6-merous	-	-	-	-	Fruit an |, |, dicotylous. 	-	-	-	orange, reddish or blue	-	blue,orange,reddish	-	-	-	-	-	     	-	-	-	-	-	-	-	-	-	-	epicortical roots both at base of plant and on twigs. 	-	-	-	-	-	-	-	-	-	Inflorescences solitary or clustered, |, an indeterminate spike or raceme of paired triads. 	-	-	-	-	-	-	-	-	-	-	-	-	-	-	-	-	-	axillary	-	axillary	-	-	-	-	Leaves paired. 	-	-	-	-	-	-	-	-	-	-	-	-	-	-	-	-	-	-	-	-	-	-	-	-	-	-	-	-	-	-	Dioecious. 	-	-	
Struthanthus concinnus 	-	-	-	-	-	-	-	Flowers not seen. 	-	-	-	-	-	-	-	-	-	-	-	-	Fruit 	-	-	-	orange or brownish	-	brown,orange	0.8 x 0.4 cm	-	-	ellipsoid	ellipsoid	     	-	-	-	-	-	-	-	-	-	-	bearing occasional epicortical roots; 	-	-	internodes terete or slightly compressed. 	terete	-	-	-	-	-	Inflorescence a raceme |, with |, 	-	-	-	-	-	-	-	-	-	-	-	-	to 3 cm long	peduncle 	-	-	1-1.5 cm long	-	-	-	3 or 4 pairs	-	-	-	-	-	-	-	-	-	-	-	-	-	-	-	-	-	Petiole |, discrete; |, acute at both ends; 	acute	-	-	-	-	-	to 8 x 2.5 cm	-	lanceolate	lanceolate	-	-	to 1 cm long	-	-	-	-	-	-	
Struthanthus dichotrianthus 	-	-	-	-	-	-	-	     	-	-	-	-	-	-	-	-	-	-	-	-	Fruit 	-	-	-	dull orange	-	orange	0.8 x 0.5 cm	-	-	ellipsoid	ellipsoid	     	-	-	-	-	-	-	-	-	-	-	-	-	-	internodes terete or slightly angled, 	terete	-	-	-	-	-	Inflorescence a slender raceme of |, 	slender	-	-	-	-	-	-	-	-	-	-	-	-	peduncle 	-	-	0.4-0.7 cm	-	-	-	1(2) pairs	-	-	-	-	-	-	-	-	-	-	-	-	-	-	-	-	-	Petiole slender, |, 	slender	-	-	-	-	-	mostly to 3(rarely -9) x 1(-3) cm	-	narrowly lanceolate	lanceolate,narrow	thin	thin	0.2-0.5 cm long	-	-	-	-	-	-	
Struthanthus gracilis 	-	-	-	-	-	-	-	Flower 	-	-	-	-	pale green	green	0.4 cm long	-	-	style nearly as long as petals,       	-	-	Fruit 	-	-	-	bright yellow	-	-	at least 0.5 x 0.35 cm	-	-	ellipsoid	ellipsoid	     	-	-	-	-	-	-	-	-	-	-	-	-	-	internodes terete, often bearing epicortical roots. 	terete	-	-	-	-	-	Inflorescence mostly solitary in leaf axils, |, bearing 	-	-	-	-	-	-	-	-	-	-	-	-	to 6 cm long	-	-	-	-	-	-	-	5-7 pairs	-	-	-	-	-	-	-	-	-	-	-	-	-	-	-	-	-	Petiole |, 	-	-	-	-	-	-	-	-	-	-	-	-	0.5-0.7 cm long	venation pinnate. 	-	-	-	-	-	
Struthanthus syringifolius 	-	-	-	-	-	-	-	     	-	-	-	-	-	-	-	-	-	-	-	-	Fruit ovoid, 	ovoid	-	-	-	-	-	to 1.2 x 0.8 cm	-	-	-	-	     	-	-	-	-	-	-	-	-	-	-	-	-	-	-	-	-	-	straight stems more or less terete at least when mature. 	terete	mat	Inflorescence |, nearly half of which may be peduncle; |, terminating in a persistent involucre of 	-	-	-	-	-	-	-	-	-	-	-	-	to 6 cm long	-	-	-	-	-	-	-	-	to 0.5 (-1) cm long	-	-	-	-	-	-	-	-	-	-	-	-	-	-	-	-	Petiole |, distinct; |, 	-	-	apex acute to somewhat caudate, 	acute	base acute to slightly obtuse; 	acute,obtuse	to 15 x 7 cm	-	broadly lanceolate	lanceolate	-	-	to 2 cm long	venation evident, pinnate. 	-	-	-	-	-	
TRIPODANTHUS  	-	-	-	-	-	-	-	Flowers bisexual, 	-	-	-	-	-	-	-	6-merous	-	-	-	-	Fruit 	-	-	-	blackish	-	black	-	-	-	ovoid	ovoid	Large, glabrous plants parasitic on branches and roots of numerous trees, with epicortical roots produced from the base and from some older stems. 	-	-	glabrous	-	-	-	-	-	-	-	-	-	-	-	-	-	-	-	-	-	Inflorescence |, an (often) determinate raceme of paired, pedunculate triads, 	-	-	-	-	-	-	-	-	-	-	-	-	-	-	-	-	-	axillary and/or terminal	-	axillary,terminal	-	-	lanceolate to ovate	lanceolate,ovate	Leaves decussate, petiolate. 	-	-	-	-	-	-	-	-	-	-	-	-	-	-	-	-	-	-	-	-	-	-	-	-	-	-	-	-	-	-	-	2000 m	-	
Tripodanthus acutifolius 	-	-	-	-	-	-	-	Flowers sunken in inflorescence axis, unisexual, |, at least female without aborted organs of opposite sex; 	-	-	-	-	-	-	-	2-4-merous	-	-	-	-	Fruit a 	-	-	-	-	-	-	-	-	-	-	-	Leafy to squamate plants. 	-	-	-	-	-	-	-	-	-	-	-	-	-	-	-	-	-	-	-	-	-	-	-	-	-	-	-	-	-	-	-	-	-	-	-	-	-	-	-	-	-	-	-	-	-	Leaves decussate. 	-	-	-	-	-	-	-	-	-	-	-	-	-	-	-	-	-	-	-	-	-	-	-	-	-	-	-	-	-	-	Monoecious or dioecious. 	-	-	
VISCACEAE  	-	-	-	-	-	-	-	-	-	-	-	-	-	-	-	-	-	-	-	-	Fruit commonly |, with persistent perianth segments; |, as is the weakly differentiated, dicotylous embryo. 	-	-	-	white	-	white	-	-	-	-	-	     	-	-	-	-	-	-	-	-	-	-	-	-	-	internodes terete or somewhat angled; 	terete	-	-	-	-	-	Inflorescences |, in axils of leaf scales or foliage leaves, solitary or in clusters, rarely in compound inflorescences, being a spike with a peduncle of at least one internode and one or more terminal, 	-	-	terminal	-	-	-	-	-	-	-	-	-	-	-	-	-	-	axillary (very rarely terminal)	-	axillary,terminal	-	-	-	-	     	-	-	-	-	-	-	-	-	-	-	-	-	-	-	-	-	-	-	-	-	-	-	-	-	-	-	-	-	-	-	Monoecious or dioecious, in the former case with diverse patterns of sex distribution on spikes and/or individuals. 	high elevations	-	
DENDROPHTHORA  	-	-	-	-	-	-	-	-	-	-	-	-	-	-	-	-	-	-	-	-	Fruit |, 	-	-	-	white	-	white	0.25 x 0.2 cm	perianth segments 	-	ovoid	ovoid	Diffusely branched plants, 	-	branched	-	-	1 pair	extremely low (sometimes to 0.3 cm above axil on larger secondary branches)	large	yellowish to deep green	-	green	-	-	-	internodes terete, 	terete	-	to 3 cm long	-	-	-	Inflorescence mostly solitary, 	-	-	-	-	-	-	-	-	-	-	1 or 2	1-3	to 0.4 cm long	peduncle 	-	-	0.05-0.1 cm	-	-	-	-	-	-	-	-	-	-	-	-	-	-	-	-	-	-	-	-	-	     	-	-	-	-	-	-	to 2 x 0.2 cm	-	narrowly lanceolate	lanceolate,narrow	-	-	-	-	-	-	Monoecious, male and female flowers on same inflorescence, former often above latter. 	High altitudes	-	
Dendrophthora decipiens 	-	-	-	-	-	-	-	-	-	-	-	-	-	-	-	-	-	-	-	-	Fruit unknown.	-	-	-	-	-	-	-	-	-	-	-	Plants 	-	-	-	-	1 or 2 pairs	-	-	dark brown	-	brown	-	-	-	-	-	-	-	-	-	-	Inflorescence |, with 	-	-	-	-	-	-	-	-	-	-	-	4-6	to 2.5 cm long	-	-	-	-	-	-	-	-	-	-	-	-	-	-	-	-	-	-	-	-	-	-	-	-	-	Petiole |, about half as wide. 	wide	-	-	-	-	-	-	-	ovate-elliptical	elliptical,ovate	-	-	0.4-0.7 cm long	-	-	-	Monoecious. 	-	-	
Dendrophthora densifrons 	-	-	-	-	-	-	-	-	-	-	-	-	-	-	-	-	-	-	-	-	Fruit |, tuberculate when young, 	-	tuberculate	-	white	-	white	0.5 x 0.6 cm	perianth segments small, 	small	ovoid to nearly spherical	ovoid,spherical	     	-	-	-	-	1 pair	to 0.5 cm above axil	-	-	-	-	-	-	-	-	-	-	-	-	-	-	Inflorescence |, simple; |, normally with |, lowest several female. 	-	-	-	-	-	-	-	-	-	-	usually 1	-	ca. 0.3 cm long	peduncle 	-	-	0.1 cm	-	-	-	-	-	elliptical to somewhat ovate	elliptical,ovate	-	-	-	-	-	-	-	-	-	-	-	-	-	-	-	-	-	-	-	-	-	-	-	-	-	-	-	-	-	-	-	Monoecious. 	-	-	
Dendrophthora elliptica 	-	-	-	-	-	-	-	-	-	-	-	-	-	-	-	-	-	-	-	-	-	-	-	-	-	-	-	-	-	-	-	-	     	-	-	-	-	-	-	-	-	-	-	-	-	-	-	-	-	-	stems terete. 	terete	-	-	-	-	-	-	-	-	-	-	-	-	-	-	-	-	-	-	-	-	-	-	-	-	-	-	-	-	-	-	-	-	-	-	-	-	-	-	-	-	Petiole |, 	-	-	apex rounded, 	rounded	base cuneately grading into massive, indistinct petiole; 	cuneate	to 8 x 3.5 cm	-	obovate	obovate	leathery	leathery	0.2-0.5 cm long	venation obscure. 	-	-	Dioecious. 	-	-	
Dendrophthora fanshawei 	-	-	-	-	-	-	-	-	-	-	-	-	-	-	-	-	-	-	-	-	Fruit unknown.	-	-	-	-	-	-	-	-	-	-	-	     	-	-	-	-	usually 2 pairs	-	-	-	-	-	-	-	-	-	-	-	-	-	-	-	Inflorescences 	-	-	-	-	-	-	-	-	-	-	3 or 4	3-7	to 2 cm long	-	-	-	-	both terminal and axillary	-	axillary,terminal	-	-	obovate to elliptic	elliptic,obovate	-	-	-	-	-	-	-	-	-	-	-	-	-	-	-	-	-	-	-	-	-	-	-	-	-	-	-	-	-	-	-	-	-	-	
Dendrophthora perfurcata 	-	-	-	-	-	-	-	-	-	-	-	-	-	-	-	-	-	-	-	-	Fruit |, 	-	-	-	white	-	white	-	perianth segments reflexed.	-	spherical	spherical	Small, 	-	-	-	-	1 pair	to 1 cm above axil	-	-	-	-	-	-	-	-	-	-	-	-	-	-	Inflorescence about half as long as subtending leaf, 	-	-	-	-	-	-	-	-	-	-	1(2)	3 or 4	-	peduncle 	-	-	0.2 cm long	axillary only	-	axillary only	-	-	narrowly lanceolate	lanceolate,narrow	-	-	-	-	-	-	-	-	-	-	-	-	-	-	-	-	-	-	-	-	-	-	-	-	-	-	-	-	-	-	-	-	-	-	
Dendrophthora roraimae 	-	-	-	-	-	-	-	-	-	-	-	-	-	-	-	-	-	-	-	-	Fruit broadly ovoid, |, 	ovoid	-	-	-	-	-	0.4 x 0.4 cm	perianth segments more or less open.	-	-	-	 |, rarely with a second pair. 	-	-	-	-	-	-	-	Olivegreen to tawny or bronze plants, in part covered with innumerable yellow spots giving a granular appearance	granular	green	-	-	-	-	-	-	-	-	-	-	Inflorescence fairly stout, |, followed by 	-	-	-	-	-	-	-	-	-	-	-	-	to 4 cm long	-	-	-	-	-	-	-	-	-	-	-	-	-	-	-	-	-	-	-	-	-	-	-	-	-	Petiole |, 	-	-	apex obtuse to rounded, 	obtuse,rounded	base tapering into stout, indistinct petiole; 	-	to 9 x 7 cm	-	ellipsoid to ovate	ellipsoid,ovate	coriaceous	coriaceous	ca. 0.5 cm long	venation obscure but apparently basal-palmate. 	palmate	-	-	-	-	
Dendrophthora warmingii 	-	-	-	-	-	-	-	Flowers small, sessile and often sunken in small axial cavities, |, occurring in diverse monoecious or dioecious patterns. 	sessile,small	-	-	-	-	-	-	3-(4-)merous	-	-	-	-	Fruit a berry, smooth to warty, mostly |, 	-	smooth	-	white, yellowish or red	-	red,white	-	perianth segments of female flower persistent, closed, 	-	-	-	     	-	-	-	-	-	-	-	-	-	-	-	-	-	internodes terete or angled. 	terete	-	-	-	-	-	     	-	-	-	-	-	-	-	-	-	-	-	-	-	peduncle simple or with several squamate, sterile internodes, followed by one to several fertile internodes; 	-	-	-	-	-	-	-	-	-	-	Leaves entire, petiolate or sessile, venation pinnate to palmate. 	palmate,sessile	-	entire	-	-	-	-	-	-	-	-	-	-	-	-	-	-	-	-	-	-	-	-	-	-	-	-	-	-	-	-	-	-	
PHORADENDRON  	-	-	-	-	-	-	-	-	-	-	-	-	-	-	-	-	-	-	-	-	Fruit |, 	-	-	-	white	-	white	0.04 x 0.025 cm	perianth segments small, 	small	ellipsoid	ellipsoid	     	-	-	-	-	1 pair	0.2-0.3 cm above base	-	-	-	-	-	-	-	internodes sharply keeled, 	-	-	6-10 cm	-	-	-	-	-	-	-	-	-	-	-	-	-	-	-	-	-	-	-	-	-	-	-	-	-	-	lanceolate	lanceolate	-	-	-	-	-	-	-	-	-	-	-	-	-	-	-	-	-	-	-	-	-	-	-	-	-	-	-	-	-	-	-	Dioecious, male plants not seen. 	-	-	
Phoradendron acuminatum 	-	-	-	-	-	-	-	-	-	-	-	-	-	-	-	-	-	-	-	-	Fruit |, 	-	-	-	-	-	-	0.6 x 0.4 cm	perianth segments closed.	-	ellipsoid	ellipsoid	Small, leafless plants, 	-	-	-	-	-	-	-	orange-brown	-	brown,orange	-	-	-	internodes terete, stout, 	terete	-	2-3 cm long	-	-	-	Inflorescences clustered at nodes, |, sometimes with several sterile internodes, 	 nodes	-	-	-	-	-	-	-	-	-	-	mostly 3	to 1.5 cm long	peduncle mostly simple, 	-	-	0.2-0.4 cm	-	-	-	-	-	-	-	-	-	-	-	-	-	-	-	-	-	-	-	-	-	-	-	-	-	-	-	-	-	-	-	-	-	-	-	-	-	-	Monoecious. 	-	-	
Phoradendron aphyllum 	-	-	-	-	-	-	-	-	-	-	-	-	-	-	-	-	-	-	-	-	Fruit |, 	-	-	-	yellowish-orange	-	orange	ca. 0.3 x 0.3 cm	perianth segments closed.	-	globose	globose	     	-	-	-	-	1 pair	ca. 0.5 cm above base	-	-	-	-	-	-	-	internodes 	-	-	to 14(18) cm long	-	-	-	Inflorescence |, simple (rarely double), followed by 	-	-	-	-	-	-	-	-	-	-	-	-	to 5 cm long	peduncle 	-	-	0.3-0.5 cm	-	-	-	-	-	-	-	-	-	-	-	-	-	-	-	-	-	-	-	-	-	Petiole |, 	-	-	apex rounded, 	rounded	base contracted into indistinct petiole; 	-	to 15 x 7 cm	-	ovate to elliptical	elliptical,ovate	-	-	to 1 cm long	venation more or less palmate. 	palmate	-	Monoecious, male flowers rare. 	-	-	
Phoradendron bathyoryctum 	-	-	-	-	-	-	-	-	-	-	-	-	-	-	-	-	-	-	-	-	Fruit |, 	-	-	-	-	-	-	ca. 0.3 x 0.25 cm	perianth segments closed.	-	ellipsoid	ellipsoid	-	-	-	-	-	-	-	-	-	-	-	-	-	-	-	-	-	-	-	-	-	-	-	-	-	-	-	-	-	-	-	-	-	-	-	-	-	-	-	-	-	-	-	-	-	-	-	-	-	-	-	-	-	-	-	-	-	-	-	-	Petiole |, 	-	-	apex more or less acute, 	acute	base cuneately tapering to indistinct petiole. 	cuneate	to 10 x 2.5 cm	-	lanceolate	lanceolate	-	-	0.5-1 cm long	-	-	-	-	-	-	
Phoradendron bilineatum 	-	-	-	-	-	-	-	-	-	-	-	-	-	-	-	-	-	-	-	-	Fruit ovoid to spherical, |, 	ovoid,spherical	-	-	-	-	-	-	perianth segments closed.	-	-	-	Yellowish |, acute, sometimes with a second pair. 	-	acute	-	-	1 pair	-	-	green	-	green	-	-	-	-	-	-	-	stems terete to slightly keeled; 	terete	-	Inflorescence |, mostly with simple peduncle |, 	-	-	-	-	-	-	-	-	-	-	3-5	-	to 1 cm long	-	-	-	-	-	-	-	-	-	-	-	-	-	-	-	-	-	-	-	-	-	-	-	-	-	Petiole |, indistinct, stout; |, 	-	-	apex acute; 	acute	-	-	to 15 x 9 cm	-	broadly lanceolate	lanceolate	-	-	0.5 cm long	-	-	-	Monoecious, sex distribution variable. 	-	-	
Phoradendron chrysocladon 	-	-	-	-	-	-	-	-	-	-	-	-	-	-	-	-	-	-	-	-	Fruit |, 	-	-	-	yellowish or pale orange to white, often reddish-brown	-	brown,orange,reddish,white	about 0.4 x 0.3 cm	perianth segments small, 	small	-	-	     	-	-	-	-	-	-	-	-	-	-	-	-	-	-	-	-	-	-	-	-	-	-	-	-	-	-	-	-	-	-	-	-	-	-	-	-	-	-	-	-	-	-	-	-	-	-	-	-	-	-	-	-	-	-	-	-	-	-	-	     	-	-	-	-	-	-	to 17 x 10 cm	-	broadly lanceolate	lanceolate	leathery	leathery	-	3-7 prominent palmate veins. 	palmate	-	Monoecious. 	low elevations	-	
Phoradendron crassifolium 	-	-	-	-	-	-	-	-	-	-	-	-	-	-	-	-	-	-	-	-	Fruit spherical, |, 	spherical	-	-	-	-	-	0.2 x 0.2 cm	perianth segments closed.	-	-	-	     	-	-	-	-	1 pair	0.3-0.5 cm above base	-	-	-	-	-	-	-	internodes strongly compressed, 	-	-	to 8 cm long	-	-	-	-	-	-	-	-	-	-	-	-	-	-	-	-	-	-	-	-	-	-	-	-	-	-	narrowly obovate to slightly spatulate	narrow,obovate,spatulate	-	-	-	-	-	-	-	-	-	-	-	-	-	-	-	-	-	-	-	-	-	-	-	-	-	-	-	-	-	-	-	Dioecious. 	-	-	
Phoradendron dipterum 	-	-	-	-	-	-	-	-	-	-	-	-	-	-	-	-	-	-	-	-	Fruit |, 	-	-	-	white	-	white	0.25-0.3 x 0.15-0.2 cm	perianth segments closed.	-	ovoid	ovoid	-	-	-	-	-	-	-	-	-	-	-	-	-	-	-	-	-	-	-	-	-	-	-	-	-	-	-	-	-	-	-	-	-	-	-	-	-	-	-	-	-	-	-	-	-	-	-	-	-	-	-	-	-	-	-	-	-	-	-	-	Petiole |, strongly winged; |, 	winged	-	apex acute or nearly so, 	acute	base long-tapering into very indistinct petiole; 	-	to 6.5 x 3 cm	-	lanceolate	lanceolate	very thin	thin	ca. 0.3 cm long	venation pinnate but lowest lateral veins strong. 	-	lateral	Dioecious. 	-	-	
Phoradendron granvillei 	-	-	-	-	-	-	-	-	-	-	-	-	-	-	-	-	-	-	-	-	Fruit |, globose to obovoid, |, 	globose,obovoid	-	-	white	-	white	0.3 x 0.3 cm	perianth segments closed.	-	-	-	     	-	-	-	-	mostly 1 pair	0.3-0.4 cm above base	-	-	-	-	-	-	-	internodes keeled to slightly quadrangular, becoming terete, 	quadrangular,terete	-	to 10 cm long	-	-	-	Inflorescence |, some inflorescences apparently entirely female, most mixed, with male flowers below female ones; |, simple or double, 	-	-	-	entire	-	-	-	-	-	-	3-5	6-10	3-6.5 cm long	peduncle 	-	-	0.3-0.5 cm	-	-	-	-	-	-	-	-	-	-	-	-	-	-	-	-	-	-	-	-	-	Petiole |, 	-	-	apex rounded, 	rounded	base tapering to abruptly contracted; 	-	7-15(18) x 3-5(7) cm	-	broadly ovate to obovate	ovate	-	-	1-1.5 cm long	venation pinnate, midrib often strikingly light in color. 	-	-	Monoecious. 	-	-	
Phoradendron hexastichum 	-	-	-	-	-	-	-	-	-	-	-	-	-	-	-	-	-	-	-	-	Fruit somewhat |, nearly |, 	-	-	-	reddish or orange	-	orange,reddish	0.4 x 0.6 cm	perianth segments 	-	ovoid	ovoid	     	-	-	-	-	-	-	-	-	-	-	-	-	-	-	-	-	-	stems mostly dichotomous through 	-	-	Inflorescence |, terminal inflorescence apparently without; 	-	-	terminal	-	-	-	-	-	-	-	4 or 5	1-3	to 3 cm long	-	-	-	-	-	-	-	-	-	-	-	-	-	-	-	-	-	-	-	-	-	-	-	-	-	Petiole stout, 	-	-	-	-	-	-	to 9 x 6 cm	-	elliptical	elliptical	-	-	to 1 cm long	venation sometimes obscure, palmate. 	palmate	-	Monoecious. 	-	-	
Phoradendron inaequidentatum 	-	-	-	-	-	-	-	-	-	-	-	-	-	-	-	-	-	-	-	-	Fruit (immature) with closed perianth segments.	-	-	-	-	-	-	-	-	-	-	-	Plants |, bronze colored at least when fresh; |, these sometimes fertile, or |, terete; 	-	terete	-	colored	1-4 pairs	-	-	-	-	-	-	-	-	-	-	-	-	stem segments between foliar nodes 	 nodes	-	Inflorescence slender,	slender	-	-	-	-	-	-	-	-	-	-	3-5	1.5-2 cm long	peduncle short, simple or unequally double,       	short	-	-	-	-	-	-	-	ovate	ovate	-	-	-	-	-	-	-	-	-	-	-	-	-	-	-	-	-	-	-	-	-	-	-	-	-	-	-	-	-	-	-	Monoecious. 	-	-	
Phoradendron krameri 	-	-	-	-	-	-	-	-	-	-	-	-	-	-	-	-	-	-	-	-	-	-	-	-	-	-	-	-	-	-	-	-	Large plants of |, upper pair 	-	-	-	-	2-4 pairs	to 3 cm above base	-	yellowish	-	-	-	-	-	internodes terete, 	terete	-	to 6 cm long	-	-	-	Inflorescence 	-	-	-	-	-	-	-	-	-	-	-	3-5(7)	to 4.5 cm long	peduncle simple or double,       	-	-	-	-	-	-	-	-	-	-	-	-	-	-	-	-	-	-	-	-	-	-	-	-	Petiole |, 	-	-	apex rounded to nearly acute, 	acute,rounded	base tapering into indistinct petiole; 	-	to 14 x 3 cm	-	narrowly oblong	narrow,oblong	coriaceous	coriaceous	0.4 cm long	3-5 palmate veins. 	palmate	-	-	-	-	
Phoradendron mairaryense 	-	-	-	-	-	-	-	-	-	-	-	-	-	-	-	-	-	-	-	-	Fruit |, 	-	-	-	bright orange or brownish orange	-	brown,orange	0.5 x 0.3 cm	perianth segments closed.	-	-	-	-	-	-	-	-	1 or 2 pairs	as low as 0.4 cm when only 1 pair, second pair to 1 cm above axil	-	Orange-yellow to yellowish brown	-	brown	-	-	-	internodes terete, 	terete	-	to 9 cm long	-	-	-	Inflorescence |, 	-	-	-	-	-	-	-	-	-	-	-	5-9	to 4.5 cm long	peduncle usually simple (both interminal and lateral inflorescences), rarely with 	-	lateral,terminal	5-7 cm long	-	-	-	-	-	lanceolate-ovate	lanceolate,ovate	-	-	-	-	-	-	-	-	-	-	-	-	-	-	-	-	-	-	-	-	-	-	-	-	-	-	-	-	-	-	-	Monoecious?	-	-	
Phoradendron morsicatum 	-	-	-	-	-	-	-	-	-	-	-	-	-	-	-	-	-	-	-	-	Fruit ovoid, |, with smooth or warty upper surface, 	ovoid	smooth	-	-	-	-	0.4 x 0.3 cm	perianth segments 	-	-	-	     	-	-	-	-	1 pair	ca. 0.2 cm above axil	-	-	-	-	-	-	-	-	-	-	-	-	-	-	Inflorescence solitary or clustered at older nodes, |, 	 nodes	-	-	-	-	-	-	-	-	-	-	3	ca. 2 cm at anthesis, elongation to 4.5 cm or less	peduncle simple, 	-	-	0.1-0.2 cm long	-	-	-	-	-	-	-	-	-	-	-	-	-	-	-	-	-	-	-	-	-	Petiole |, with rounded to mucronate or emarginate apex, 	rounded	-	-	-	base acute, tapering into indistinct petiole; 	acute	to 3 x 1.5 cm	-	mostly elliptical to obovate	elliptical,obovate	-	-	0.2-0.3 cm long	venation of 3 conspicuous palmate veins. 	palmate	-	Monoecious. 	-	-	
Phoradendron mucronatum 	-	-	-	-	-	-	-	-	-	-	-	-	-	-	-	-	-	-	-	-	Fruit 	-	-	-	white	-	white	-	-	-	-	-	Dichotomous, |, somewhat tubular, |, inconspicuous. 	-	tubular	-	-	1 pair	0.2-0.3 cm above base	-	-	-	-	-	-	-	internodes terete but somewhat keeled below young nodes, 	 nodes,terete	-	to 7 cm long	-	-	-	Inflorescence slender, 	slender	-	-	-	-	-	-	-	-	-	mostly 2 or 3	5-9	to nearly 2 cm	peduncle 	-	-	0.3-0.5 cm	-	-	-	-	-	-	-	-	-	-	-	-	-	-	-	-	-	-	-	-	-	Petiole |, 	-	-	apex rounded to notched, 	rounded	base contracted to indistinct; 	-	to 6 x 3.5 cm	-	obovate	obovate	-	-	ca. 0.3 cm long	venation pinnate but obscure. 	-	-	Monoecious. 	-	-	
Phoradendron northropiae 	-	-	-	-	-	-	-	-	-	-	-	-	-	-	-	-	-	-	-	-	Fruit |, 	-	-	-	translucent white	-	white	0.6-0.7 x 0.35 cm	perianth segments large, flaring.	large	-	-	     	-	-	-	-	1 pair	0.1-0.3 cm above base	-	-	-	-	-	-	-	internodes compressed/keeled above, terete below, 	terete	-	3-8 cm long	-	-	-	     	-	-	-	-	-	-	-	-	-	-	2 or 3	4-9	-	-	-	-	-	-	-	-	-	-	-	-	-	-	-	-	-	-	-	-	-	-	-	-	-	-	Petiole |, rather slender; |, 	slender	-	apex rounded, 	rounded	base cuneate, tapering into indistinct petiole; 	cuneate	to 8 x 3 cm	-	obovate or oblong	oblong,obovate	-	-	ca. 0.5 cm long	venation often with 	-	-	Monoecious. 	-	-	
Phoradendron obtusissimum 	-	-	-	-	-	-	-	-	-	-	-	-	-	-	-	-	-	-	-	-	Fruit globose, |, 	globose	-	-	-	-	-	-	perianth segments closed.	-	-	-	     	-	-	-	-	-	-	-	-	-	-	-	-	-	leaf-bearing internodes 	-	-	2-5 cm long	-	-	-	Inflorescence peduncle mostly simple but sometimes with 	-	-	-	-	-	-	-	-	-	-	2 or 3	-	0.1-0.3 cm long	-	-	-	-	-	-	-	-	-	narrowly elliptical	elliptical,narrow	-	-	-	-	-	-	-	-	-	-	-	-	-	-	-	-	-	-	-	-	-	-	-	-	-	-	-	-	-	-	-	Dioecious; occasional bisexual plant and possibly some unisexual inflorescences.	-	-	
Phoradendron pellucidulum 	-	-	-	-	-	-	-	-	-	-	-	-	-	-	-	-	-	-	-	-	Fruit |, spherical, |, 	spherical	-	-	translucent white	-	white	0.4 x 0.3 cm	perianth segments closed.	-	-	-	     	-	-	-	-	1 or 2(3) pairs	lowest at about 0.6 cm, highest to 2 cm above base	-	-	-	-	-	-	-	internodes terete or slightly keeled above. 	terete	-	to 9 cm long	-	-	-	Inflorescence often long and sinuous, |, very low; 	-	-	-	-	-	-	-	-	-	-	-	-	8 cm long or longer	-	-	-	-	-	-	-	-	-	-	-	-	-	-	-	-	-	-	-	-	-	-	-	-	-	Petiole |, 	-	-	apex rounded, 	rounded	base cuneately tapering into indistinct petiole; 	cuneate	to 15 x 4 cm	-	elliptical	elliptical	-	-	0.5 cm long	venation pinnate, but basal lateral veins often very strong. 	-	lateral	Monoecious. 	-	-	
