Phoradendron perrottetii 	-	-	-	-	-	-	-	-	-	-	-	-	-	-	-	-	-	-	-	-	Fruit |, 	-	-	-	yellow or yellowish-red	-	red	-	perianth segments 	-	spherical to elliptical	elliptical,spherical	-	-	-	-	-	-	-	-	-	-	-	-	-	-	-	-	-	-	-	-	-	Inflorescence |, sometimes on same spike, when 	-	-	-	-	-	-	-	-	-	-	5-8	-	up to 8 cm long	-	-	-	-	-	-	-	-	-	-	-	-	-	-	-	-	-	-	-	-	-	-	-	-	-	Petiole |, often with slightly attenuate apex and undulate margin, 	attenuate	undulate	-	-	base acute. 	acute	up to 14 x 7 cm	-	lanceolate	lanceolate	-	-	0.4-0.8 cm long	-	-	-	     	lower elevations	-	
Phoradendron piperoides 	-	-	-	-	-	-	-	-	-	-	-	-	-	-	-	-	-	-	-	-	Fruit |, smooth, 	-	smooth	-	orange	-	orange	0.6 x 0.5 cm	perianth segments 	-	ovoid	ovoid	     	-	-	-	-	-	-	-	-	-	-	-	-	-	all long internodes, whether in 	-	-	-	-	-	-	Inflorescence |, doubling in length when fruiting, with 	-	-	-	-	-	-	-	-	-	-	-	3	1 cm long	-	-	-	-	mostly lateral	-	lateral	-	-	-	-	-	-	-	-	-	-	-	-	-	-	-	-	-	-	-	-	-	-	-	-	-	-	-	-	-	-	-	-	-	-	-	Monoecious. 	-	-	
Phoradendron poeppigii 	-	-	-	-	-	-	-	-	-	-	-	-	-	-	-	-	-	-	-	-	Fruit ovoid, |, smooth, 	ovoid	smooth	-	-	-	-	0.4 x 0.25 cm	perianth segments closed.	-	-	-	-	-	-	-	-	-	-	-	-	-	-	-	-	-	-	-	-	-	-	-	-	Inflorescence |, with |, crowded; 	-	-	-	-	-	-	-	-	-	-	3-6	(3)5(7)	to 5 cm long	-	-	-	-	-	-	-	-	-	-	-	-	-	-	-	-	-	-	-	-	-	-	-	-	-	Petiole |, 	-	-	apex rounded, 	rounded	base abruptly tapered into petiole. 	-	to 9(-12) x 6 cm	-	(ob)ovate to elliptic	(ob)ovate,elliptic	-	-	ca. 1 cm long	-	-	-	Monoecious? (spikes of all 3 specimens identical). 	-	-	
Phoradendron pteroneuron 	-	-	-	-	-	-	-	-	-	-	-	-	-	-	-	-	-	-	-	-	-	-	-	-	-	-	-	-	-	-	-	-	     	-	-	-	-	1(2) pair	1-1.5 cm above axil	-	-	-	-	-	-	-	internodes terete below, expanding just below massive node, 	terete	-	to 7 cm long	-	-	-	-	-	-	-	-	-	-	-	-	-	-	-	-	-	-	-	-	-	-	-	-	-	-	-	-	-	-	-	-	-	-	-	-	-	-	-	-	-	-	Petiole |, 	-	-	apex rounded, 	rounded	base cuneately tapering into indistinct petiole; 	cuneate	to 9 x 3 cm	-	narrowly obovate to spathulate	narrow,obovate,spathulate	coriaceous	coriaceous	ca. 0.5 cm long	-	-	-	Dioecious? Inflorescence |, with 	-	-	
Phoradendron pulleanum 	-	-	-	-	-	-	-	-	-	-	-	-	-	-	-	-	-	-	-	-	Fruit |, 	-	-	-	yellow or slightly orange (not red)	-	orange,red	-	perianth segments closed.	-	spherical	spherical	Plants often rather small, glabrous, |, inconspicuous. 	-	small	glabrous	-	-	-	-	-	-	-	-	-	-	internodes sharply quadrangular at least when young; 	quadrangular	-	-	-	-	-	Inflorescence 	-	-	-	-	-	-	-	-	-	-	3-6	mostly to 9	to 2.5 cm or more	-	-	-	-	-	-	-	-	-	-	-	-	-	-	-	-	-	-	-	-	-	-	-	-	-	     	-	-	apex rounded, 	rounded	base cuneate. 	cuneate	2-5 cm	-	obovate to lanceolate-spatulate	lanceolate,obovate,spatulate	-	-	-	-	-	-	Monoecious. 	-	-	
Phoradendron quadrangulare 	-	-	-	-	-	-	-	-	-	-	-	-	-	-	-	-	-	-	-	-	Fruit |, 	-	-	-	-	-	-	0.25 x 0.15 cm	perianth segments small, closed.	small	oblong	oblong	Rather large plants often drying |, dichotomous by abortion; |, where stem tends to be terete; 	-	large,terete	-	-	-	-	-	blackish	-	black	-	-	-	internodes quadrangular above, rather long (often 	quadrangular	-	10-12 cm or more	-	-	-	Inflorescences first paired, later clustered at nodes, |, 	 nodes	-	-	-	-	-	-	-	-	-	3	-	mostly to 3 cm long	rest of peduncle 	-	-	ca. 0.3 cm long	-	-	-	-	-	-	-	-	-	-	-	-	-	-	-	-	-	-	-	-	-	Petiole |, 	-	-	apex blunt to acute, 	acute	base abruptly tapering into petiole. 	-	mostly to 12 x 8 cm	-	elliptical to ovate or broadly lanceolate	elliptical,lanceolate,ovate	-	-	0.5-1 cm long	-	-	-	Monoecious. 	-	-	
Phoradendron racemosum 	-	-	-	-	-	-	-	-	-	-	-	-	-	-	-	-	-	-	-	-	Fruit |, 	-	-	-	yellow-orange to red	-	orange,red	0.4 x 0.3 cm	perianth segments 	-	ovoid	ovoid	-	-	-	-	-	-	-	-	-	-	-	-	-	-	-	-	-	-	-	-	-	Inflorescences |, 	-	-	-	-	-	-	-	-	-	-	-	-	about 1.5 cm long	-	-	-	-	paired or clustered at nodes but also terminal	 nodes	terminal	-	-	-	-	-	-	-	-	-	-	-	-	-	-	-	-	-	-	Petiole |, 	-	-	apex attenuate, 	attenuate	base contracted to petiole. 	-	to 4 x 1 cm	-	narrowly ovate	narrow,ovate	rather leathery	leathery	0.2 cm long	-	-	-	Monoecious. 	-	-	
Phoradendron strongyloclados 	-	-	-	-	-	-	-	-	-	-	-	-	-	-	-	-	-	-	-	-	Fruit |, relatively large, |, with rather narrow tip when dry, 	large,narrow	-	-	dull orange	-	orange	0.5 x 0.3 cm	perianth segments 	-	ovoid	ovoid	     	-	-	-	-	-	-	-	-	-	-	-	-	-	internodes at first somewhat flattened to quadangular, 	angular,flattened	-	to 6 cm long	-	-	-	Inflorescence |, or |, with 	-	-	-	-	-	-	-	-	-	-	2 or 3	-	to 2.5 cm long	peduncle simple, 	-	-	0.1-0.4 cm long	-	-	-	-	-	-	-	-	-	-	-	-	-	-	-	-	-	-	-	-	-	     	-	-	-	-	base cuneate; 	cuneate	to 5 x 2 cm	-	spatulate to elliptical	elliptical,spatulate	rather thick	thick	-	usually 3 prominent palmate veins of about same length. 	palmate	-	-	-	-	
Phoradendron trinervium 	-	-	-	-	-	-	-	-	-	-	-	-	-	-	-	-	-	-	-	-	Fruit |, 	-	-	-	white	-	white	0.3 x 0.2 cm	perianth segments closed.	-	ovoid	ovoid	     	-	-	-	-	1-4 pairs	2-5 cm above axil	-	-	-	-	-	-	-	internodes keeled and compressed especially below node, sometimes 	-	-	to 10-12 cm long	-	-	-	Inflorescence |, each with 	-	-	-	-	-	-	-	-	-	-	-	5-7	-	-	-	-	-	axillary and at older nodes	 nodes	axillary	-	-	-	-	-	-	-	-	-	-	-	-	-	-	-	-	-	-	Petiole |, commonly half this size, 	-	-	apex acute; 	acute	-	-	to 17 x 7 cm	-	lanceolate to narrowly ovate	lanceolate,narrow,ovate	-	-	ca. 1 cm long	venation obscure but pinnate. 	-	-	Monoecious. 	-	-	
Phoradendron undulatum 	-	-	-	-	-	-	-	-	-	-	-	-	-	-	-	-	-	-	-	-	-	-	-	-	-	-	-	-	-	-	-	-	-	-	-	-	-	-	-	-	-	-	-	-	-	-	-	-	-	-	-	-	-	-	-	-	-	-	-	-	-	-	-	-	-	-	-	-	-	-	-	-	-	-	-	-	-	-	-	-	-	-	-	-	-	-	-	-	-	-	-	-	-	-	-	-	-	-	-	-	-	-	-	-	-	-	-	-	-	-	-	-	
