HEMIGRAPHIS  	-	-	-	-	-	-	-	-	-	-	-	-	-	-	-	-	-	-	-	-	-	-	-	-	-	-	-	-	-	-	-	-	-	-	-	-	-	-	-	-	-	-	-	-	-	-	-	-	-	-	-	-	-	-	-	-	-	-	-	-	-	-	-	-	-	-	-	-	-	-	-	-	-	-	-	-	-	-	-	-	-	-	-	-	-	Capsules |, 	-	-	-	-	-	-	-	-	-	-	-	-	-	-	-	-	retinacula present, septae with retinacula remaining attached to inner wall of mature capsule; 	-	mat	-	-	-	-	-	pubescent	-	-	-	-	-	6-12	flat	flat	-	-	-	-	-	-	fusiform, seminiferous from base	fusiform	-	-	     	-	-	-	-	-	-	-	-	-	-	-	lobes 	-	-	ciliolate	-	ciliolate	linear-subulate	linear,subulate	corolla 	-	usually lavender, white or purplish	-	-	lavender,purplish,white	-	-	-	-	-	-	-	limb subregular, and subequally 	-	subregular	-	-	-	-	-	-	-	-	-	-	-	-	-	-	-	-	-	-	-	-	-	-	-	-	-	stamens 	-	-	-	filaments united at base by a membrane, 	-	-	-	-	-	-	thecae equal, parallel, muticous at base, 	parallel	-	-	-	-	-	-	-	-	-	-	-	-	-	-	-	-	Erect or ascending, rarely creeping	ascending,creeping	-	-	Inflorescences 	-	-	-	-	-	-	-	-	-	-	-	-	-	-	-	-	-	-	-	-	-	-	-	-	-	-	-	-	-	-	-	-	-	-	-	-	-	-	-	-	-	-	-	-	-	-	-	terminal or axillary	-	axillary,terminal	-	-	-	-	-	-	-	-	-	-	-	-	-	-	-	-	     	-	-	-	blades usually crenate or undulate, sometimes entire. 	-	-	crenate,entire,undulate	-	-	-	-	-	-	-	-	-	-	-	-	-	-	-	-	-	-	-	-	-	-	-	-	-	-	-	-	-	-	-	-	-	-	-	-	-	-	-	-	-	-	-	-	-	-	-	-	-	-	-	-	Stems 	-	-	more or less pubescent	-	-	-	-	-	-	-	-	-	-	-	-	-	-	-	
Hemigraphis alternata 	-	-	-	-	-	-	-	-	-	-	-	-	-	-	-	-	-	-	-	-	-	-	-	-	-	-	-	-	-	-	-	-	-	-	-	-	-	-	-	-	-	-	-	-	-	-	-	-	-	-	-	-	-	-	-	-	-	-	-	-	-	-	-	-	-	-	-	-	-	-	-	-	-	-	-	-	-	-	-	-	-	-	-	-	-	Capsule not seen.	-	-	-	-	-	-	-	-	-	-	-	-	-	-	-	-	-	-	-	-	-	-	-	-	-	-	-	-	-	-	-	-	-	-	-	-	-	-	-	-	-	-	-	Flowers |, |, extending beyond subtending bracts, |, |, |, 	-	-	-	-	-	-	-	-	-	-	7-10 mm long	lobes equal, 	-	-	ciliate	-	ciliate	linear-subulate	linear,subulate	corolla 	-	white	-	-	white	minutely pubescent	minute	-	minutely pubescent	minute	-	15-18 mm long	limb subregular, 	-	subregular	lobes 	-	-	-	oval	-	-	-	-	-	-	-	-	-	-	-	11-14 mm long	-	-	-	-	-	-	-	-	stamens included, 	-	-	1.5 mm long	filaments 	-	-	-	-	-	-	thecae 	-	-	rounded or acute basally	acute,rounded	-	-	-	-	-	-	-	Low-growing diffuse herb or subshrub, 	subshrub	-	-	-	-	-	-	30-35 cm tall	-	Inflorescence |, densely bracted, |, spikes |, 	-	-	-	-	densely	-	-	bracteoles minute or absent. 	minute	-	-	-	-	-	-	-	bracts sessile to petiolate, 	sessile	-	-	-	-	-	8-15 x 4.5 mm	-	inconspicuously puberulous	-	-	puberulous	ciliate	ciliate	ovate-lanceolate to oblong	lanceolate,oblong,ovate	-	-	-	-	-	2-3 cm long	-	-	-	-	-	pilose	pilose	15 mm long	axillary and terminal	-	axillary,terminal	-	rachis 	puberulous	-	puberulous	-	-	-	-	-	-	-	-	-	-	-	-	-	-	-	-	-	-	-	-	-	-	-	-	-	-	-	-	-	Petiole |, 	-	-	-	-	blade 	-	acute or obtuse	acute,obtuse	3-11 x 2-7 cm	-	-	-	-	purple, portions turning indigo upon drying	indigo,purple	-	-	sparingly ciliate	ciliate	crenate	crenate	-	-	-	broadly ovate to ovate-oblong to cordate	cordate,oblong,ovate	-	-	-	pilose	-	pilose	-	1.5 cm long	-	-	-	-	-	-	-	Stem |, rooting at lower nodes. 	 nodes	-	sparingly puberulous	-	puberulous	-	-	subquadrangular	subquadrangular	-	-	-	-	-	-	-	-	-	
HERPETACANTHUS  	-	-	-	-	-	-	-	-	-	-	-	-	-	-	-	-	-	-	-	-	-	-	-	-	-	-	-	-	-	-	-	-	-	-	-	-	-	-	-	-	-	-	-	-	-	-	-	-	-	-	-	-	-	-	-	-	-	-	-	-	-	-	-	-	-	-	-	-	-	-	-	-	-	-	-	-	-	-	-	-	-	-	-	-	-	Capsules, stipitate, |, 	stipitat	-	-	-	-	-	-	-	-	-	-	-	-	-	-	-	retinacula curved; 	curved	-	-	-	-	-	-	glabrous	-	-	glabrous	-	-	2-4	lenticular	lenticular	-	-	-	-	-	-	acute	acute	-	-	Flowers |, bilipped, homostylous; |, |, posterior (adaxial) lobe, anterior (abaxial) pair and lateral pair of unequal width; |, personate, |, didynamous, inserted at base or in middle of widest part of tube, united in pairs at base, exserted, 	bilipped,wide	-	exserted,lateral	-	-	-	-	-	-	-	-	lobes subequal, 	-	-	-	-	-	lanceolate	lanceolate	corolla small, straight,       	small	-	-	-	-	-	-	-	-	-	-	-	limb 	-	-	lobes subequal; 	-	-	-	-	-	erect or ± spreading	erect	-	-	-	-	-	-	-	-	-	basally cylindrical, upper half campanulate	campanulate,cylindric	-	-	-	-	-	-	stamens 	-	-	-	-	-	-	-	-	-	-	-	-	-	-	-	-	-	-	-	-	-	-	Perennial shrubs or subshrubs. 	subshrub	-	-	-	-	-	-	-	-	Inflorescences |, often with conspicuous leafy bracts; |, entire; |, laterally subtending calyx. 	-	-	lateral	entire	-	-	-	bracteoles 	-	-	-	-	-	-	-	-	bracts imbricate, 	-	-	-	light green, drying darker green than cauline leaves	-	green	-	-	-	-	-	-	-	-	asymmetrical	asymmetrical	-	-	-	-	-	-	-	-	-	-	-	-	-	-	terminal or axillary	-	axillary,terminal	-	-	-	-	-	-	-	-	-	-	-	-	-	-	-	-	     	-	-	-	blades usually large, 	large	-	-	prominently covered with cystoliths	-	-	-	-	-	-	narrowly ovate	narrow,ovate	-	-	-	-	-	-	-	-	-	-	-	-	-	-	-	-	-	-	-	-	-	-	-	-	-	-	-	-	-	-	-	-	-	-	-	-	-	-	-	-	-	-	-	Stem |, articulated, 	-	-	glabrous to pubescent	-	glabrous	-	-	subquadrangular	subquadrangular	-	-	-	-	-	-	-	-	-	
Herpetacanthus rotundatus 	-	-	-	-	-	-	-	-	-	-	-	-	-	-	-	-	-	-	-	-	-	-	-	-	-	-	-	-	-	-	-	-	-	-	-	-	-	-	-	-	-	-	-	-	-	-	-	-	-	-	-	-	-	-	-	-	-	-	-	-	-	-	-	-	-	-	-	-	-	-	-	-	-	-	-	-	-	-	-	-	-	-	-	-	-	Capsule |, |, irregularly orbicular	orbicular	-	-	-	regular	ellipsoid	ellipsoid	-	-	-	-	-	-	-	-	10 mm long	-	-	-	-	-	-	-	2 x 1-1.5 mm	-	-	-	-	-	-	-	flattened, 	flattened	-	-	-	-	-	-	-	-	-	4 mm long	     	-	-	-	-	-	-	-	-	-	-	3.5-4 mm long	-	-	-	-	-	-	-	-	corolla 	-	white or pale violet	-	-	violet,white	glabrous	-	-	glabrous	-	-	15-16 mm long	-	-	-	-	-	-	-	-	-	-	-	-	-	-	-	ovate, 	ovate	-	-	11-12 mm long	-	-	-	3.8 mm long	-	narrowly ovate	narrow,ovate	-	stamens inserted in middle of 	-	-	-	filaments 	-	-	-	22 and 44 mm long respectively	-	-	anther thecae 	-	1.1 mm long	-	-	-	-	-	-	-	-	-	Shrub or subshrub, 	subshrub	-	-	-	-	-	-	1-1.5 m tall	-	Inflorescence terminating main and lateral branches, spikes |, apically obtuse or subobtuse and minutely mucronulate, |, usually somewhat oblique	minute,oblique,obtuse	-	lateral	-	-	-	-	bracteoles 	-	4 x 0.6 mm	glabrous	-	glabrous	-	narrowly triangular	narrow,triangular	bracts 	-	-	-	-	-	-	-	-	glabrous, shortly ciliate	short	-	ciliate,glabrous	-	-	ovate-orbicular, 	orbicular,ovate	12-13 x 8-10 mm	-	-	-	-	3-4 cm long	-	-	-	-	-	-	-	0.5-1 cm long	-	-	-	-	rachis zigzag, 	glabrous to minutely pubescent	minute	glabrous,minutely pubescent	minute	-	-	-	-	-	-	-	-	-	-	-	-	-	-	-	-	-	-	-	-	-	-	-	-	-	-	-	-	Petiole |, 	-	-	-	-	blade 	-	acute	acute	6-14 x 4-6.5 cm	-	glabrous or subglabrous on both upper and lower surface	-	glabrous	-	-	-	-	-	-	entire to shallowly crenulate	crenulate,entire	-	-	-	elliptic to narrowly ovate	elliptic,narrow,ovate	-	-	-	puberulous	-	puberulous	-	0.5-2 cm long	-	-	-	-	-	-	-	Stem |, branching, |, 	-	-	-	-	-	-	-	subquadrangular	subquadrangular	rare in non-flooded moist forests	forest	-	-	-	-	-	-	-	
HYGROPHILA  	-	-	-	-	-	-	-	-	-	-	-	-	-	-	-	-	-	-	-	-	-	-	-	-	-	-	-	-	-	-	-	-	-	-	-	-	-	-	-	-	-	-	-	-	-	-	-	-	-	-	-	-	-	-	-	-	-	-	-	-	-	-	-	-	-	-	-	-	-	-	-	-	-	-	-	-	-	-	-	-	-	-	-	-	-	Capsules estipitate, |, |, septae with retinacula remaining attached to inner wall of mature capsule; |, unequal at base, 	stipitat	-	-	-	mat	-	-	-	-	-	-	-	-	-	-	-	retinacula present, 	-	-	-	-	-	-	-	covered with hygroscopic trichomes	-	-	trichomes	-	-	4-18	lenticular	lenticular	-	-	-	-	-	-	linear-ellipsoid	ellipsoid,linear	-	-	     	-	-	-	-	-	-	-	-	-	-	-	lobes subequal, 	-	-	-	-	-	linear	linear	corolla tube 	-	-	-	-	-	-	-	-	-	-	-	-	slightly curved limb ± personate	curved	-	-	-	-	-	-	-	-	-	-	-	-	-	-	-	-	-	-	-	-	-	-	-	-	-	-	stamens 	-	-	-	filaments of each pair usually basally connate by a membrane, 	-	-	connate	-	-	-	thecae equal in length, parallel to sagittate, equally inserted, basally muticous or mucronulate; 	parallel	-	-	-	-	-	-	-	-	-	-	-	-	-	-	-	-	Diffuse to erect	erect	-	-	     	-	-	-	-	-	-	-	-	-	-	-	-	-	-	-	-	-	-	-	-	-	-	-	-	-	-	-	-	-	-	-	-	-	-	-	-	-	-	-	-	-	-	-	-	-	-	-	-	-	-	-	-	-	-	-	-	-	-	-	-	-	-	-	-	-	-	     	-	-	-	blades usually narrow,       	narrow	-	-	cystoliths present. 	-	-	-	-	-	-	-	-	-	-	-	-	-	-	-	-	-	-	-	-	-	-	-	-	-	-	-	-	-	-	-	-	-	-	-	-	-	-	-	-	-	-	-	-	-	-	-	-	-	-	-	Stems 	-	-	-	-	-	-	-	quadrangular	quadrangular	-	-	-	-	-	-	-	-	-	
Hygrophila costata 	-	-	-	-	-	-	-	-	-	-	-	-	-	-	-	-	-	-	-	-	-	-	-	-	-	-	-	-	-	-	-	-	-	-	-	-	-	-	-	-	-	-	-	-	-	-	-	-	-	-	-	-	-	-	-	-	-	-	-	-	-	-	-	-	-	-	-	-	-	-	-	-	-	-	-	-	-	-	-	-	-	-	-	-	-	Capsule |, obtuse and apiculate|, |, irregularly orbicular	apiculate,obtuse,orbicular	-	-	-	regular	-	-	-	-	-	-	-	-	-	-	-	retinacula 	-	-	0.5-0.8 mm long	-	-	-	1.2 x 1 mm	-	-	-	-	-	-	12-18	flattened, 	flattened	-	-	-	-	-	-	narrowly oblong, 	narrow,oblong	9-14 x 2 x 1.5-1.6 mm	-	     	-	-	-	-	-	-	-	-	-	-	6-12 mm long	lobes 	-	-	glabrous or with few scattered trichomes	-	glabrous,trichomes	narrowly lanceolate, apically long-attenuate	attenuate,lanceolate,narrow	corolla 	-	white	-	-	white	pubescent	-	-	-	-	-	6-9 mm long	-	-	-	-	-	-	-	-	-	-	-	3 mm long	1.5-2 x 0.8-1.2 mm	elliptic	elliptic	-	-	-	-	3.5-4 mm long	-	-	-	2.8-3 mm long	-	-	-	-	stamens inserted near base of throat, 	-	-	0.8 mm	-	-	-	-	-	-	-	-	-	-	-	-	-	-	-	-	-	-	-	|, aquatic to subaquatic herb, 	-	-	-	-	-	Erect to spreading	-	0.5-2 m tall	-	Inflorescence of opposite or alternate dichasia, |, 	-	-	-	-	-	-	-	-	-	-	-	-	-	-	-	-	-	-	-	-	-	-	-	-	-	-	-	-	-	-	-	-	-	-	-	-	-	-	-	-	-	-	-	-	-	-	to 1 mm long	-	-	-	-	-	-	-	-	-	-	-	Younger stem |, inconspicuously lenticellate. 	-	glabrous to sparingly hirtellous	-	glabrous,hirtellous	-	quadrate-sulcate to hexagonal-ridged	hexagonal,quadrate	-	-	-	-	-	-	-	-	-	-	-	-	-	-	-	-	-	-	Petiole |, 	-	-	-	-	blade 	-	acuminate	acuminate	5-25 x 0.5-4 cm	-	-	-	-	-	-	-	-	-	-	entire to subcrenate	crenate,entire	-	-	-	lanceolate to narrowly elliptic	elliptic,lanceolate,narrow	-	-	-	glabrate or sparingly pilose	-	glabrate,pilose	-	0.5-3 cm long	-	-	-	-	-	-	-	-	-	-	-	-	-	-	-	-	-	-	-	-	-	-	-	-	-	-	
Hygrophila erecta 	-	-	-	-	-	-	-	-	-	-	-	-	-	-	-	-	-	-	-	-	-	-	-	-	-	-	-	-	-	-	-	-	-	-	-	-	-	-	-	-	-	-	-	-	-	-	-	-	-	-	-	-	-	-	-	-	-	-	-	-	-	-	-	-	-	-	-	-	-	-	-	-	-	-	-	-	-	-	-	-	-	-	-	-	-	Capsule |, obtuse and apiculate|, |, irregularly orbicular	apiculate,obtuse,orbicular	-	-	-	regular	-	-	-	-	-	-	-	-	-	-	-	retinacula 	-	-	0.5-0.8 mm long	-	-	-	1.2 x 1 mm	-	-	-	-	-	-	12-18	flattened, 	flattened	-	-	-	-	-	-	narrowly oblong, 	narrow,oblong	13-14 x 2 x1.8-2 mm	-	     	-	-	-	-	-	-	-	-	-	-	11-14 mm long	lobes 	-	-	sparingly hirsute	-	hirsute	narrowly linear-lanceolate, 	lanceolate,linear,narrow	corolla 	-	reddish	-	-	reddish	sparingly and minutely pubescent without	minute	-	minutely pubescent	minute	-	17-20 mm long	-	-	-	-	-	-	-	-	-	-	-	8-9 mm long	2-2.5 x 1.5 mm	oblong-lanceolate	oblong-lanceolate	-	-	-	-	-	-	-	-	9-10 mm long	-	-	-	-	stamens inserted near base of throat, 	-	-	2 mm long	-	-	-	-	-	-	-	-	-	-	-	-	-	-	-	-	-	-	-	|, aquatic, to subaquatic herb, 	-	-	-	-	-	Erect to spreading	-	40-100 cm tall	-	Inflorescence of opposite or alternate dichasia, |, |, 	-	-	-	-	-	-	-	bracteoles 	-	6 x 3 mm	moderately pilose	-	pilose	-	narrowly oblong	narrow,oblong	bracts subtending lateral flowers 	-	lateral	-	-	-	-	5-14 x 6-8 mm	-	moderately pilose	-	-	pilose	ciliolate	ciliolate	oblong-lanceolate	oblong-lanceolate	-	-	-	-	-	-	-	-	-	-	-	-	-	to 1 mm long	-	-	-	-	-	-	-	-	-	-	-	Younger stem |, |, inconspicuously lenticellate. 	-	glabrous	-	glabrous	-	quadrate-sulcate to hexagonal-ridged	hexagonal,quadrate	-	-	-	-	-	-	-	-	-	-	-	-	-	-	-	-	-	-	Petiole |, 	-	-	-	-	blade 	-	obtuse or rotundate	obtuse,rotundate	2.5-7 x 1.8-4 cm	-	-	-	-	-	-	-	-	-	-	entire	entire	-	-	-	narrowly oblong-obovate to oblanceolate	narrow,oblanceolate,oblong,obovate	-	-	-	glabrate or sparingly pilose	-	glabrate,pilose	-	0.5-1 cm long	-	-	-	-	-	-	-	-	-	-	-	-	-	-	-	-	-	-	-	-	-	-	-	-	-	-	
Hygrophila sandwithii 	-	-	-	-	-	-	-	-	-	-	-	-	-	-	-	-	-	-	-	-	-	-	-	-	-	-	-	-	-	-	-	-	-	-	-	-	-	-	-	-	-	-	-	-	-	-	-	-	-	-	-	-	-	-	-	-	-	-	-	-	-	-	-	-	-	-	-	-	-	-	-	-	-	-	-	-	-	-	-	-	-	-	-	-	-	Capsule not seen.	-	-	-	-	-	-	-	-	-	-	-	-	-	-	-	-	-	-	-	-	-	-	-	-	-	-	-	-	-	-	-	-	-	-	-	-	-	-	-	-	-	-	-	     	-	-	-	-	-	-	-	-	-	-	-	lobes equal, 	-	6 x 0.5-0.7 mm	-	-	-	narrowly linear	linear,narrow	corolla 	-	mauve	-	-	mauve	glabrous without	-	-	glabrous	-	-	8.5-9 mm long	-	-	-	-	-	-	-	-	-	-	-	-	-	-	-	-	-	-	-	-	-	-	-	3 mm long	1.2 mm long	-	-	-	lower pair of stamens inserted at middle of corolla tube, shorter pair inserted at tip of corolla tube, sometimes with exceedingly unequal thecae,       	short	-	1.1 and 0.7 mm long respectively	filaments free at base, 	-	-	-	3.8 and 1.5 mm long respectively	-	-	-	-	-	-	-	-	-	-	-	-	-	-	|, semiaquatic, decumbent herb, 	-	-	-	-	-	Erect to spreading	-	20-25 cm tall	-	Inflorescence of opposite or alternate dichasia, |, 	-	-	-	-	-	-	-	-	-	-	-	-	-	-	-	-	bracts subtending lateral flowers 	-	lateral	-	-	-	-	7 x 15 mm	-	basally sparingly pilose	-	-	pilose	ciliolate	ciliolate	spathulate	spathulate	-	-	-	-	-	-	-	-	-	-	-	-	-	-	-	-	-	-	-	-	-	-	-	-	-	-	-	-	-	-	-	-	-	     	-	-	-	blade 	-	-	-	-	-	-	-	-	-	-	linear-lanceolate	lanceolate,linear	-	-	-	-	-	-	-	-	-	-	-	-	-	-	-	-	-	-	-	-	-	-	-	-	-	-	-	-	-	-	-	-	-	-	-	-	-	-	-	-	-	-	-	Stem |, sulcate, angles and interpetiolar lines sometimes fimbriate, 	-	-	-	-	-	-	-	obtusely quadrangular	obtuse	sandy foreshores and muddy river banks	mud	-	-	-	-	-	-	-	
Hygrophila surinamensis 	-	-	-	-	-	-	-	-	-	-	-	-	-	-	-	-	-	-	-	-	-	-	-	-	-	-	-	-	-	-	-	-	-	-	-	-	-	-	-	-	-	-	-	-	-	-	-	-	-	-	-	-	-	-	-	-	-	-	-	-	-	-	-	-	-	-	-	-	-	-	-	-	-	-	-	-	-	-	-	-	-	-	-	-	-	Capsule |, obtuse and apiculate|, |, irregularly orbicular	apiculate,obtuse,orbicular	-	-	-	regular	-	-	-	-	-	-	-	-	-	-	-	retinacula 	-	-	0.8 mm long	-	-	-	0.7 x 0.5 mm	-	-	-	-	-	-	14	flattened, 	flattened	-	-	-	-	-	-	narrowly oblong, 	narrow,oblong	9-10 x 1.6 x 1-1.2 mm	-	     	-	-	-	-	-	-	-	-	-	-	about 6 mm long, accrescent to 9.5 mm	lobes 	-	-	hirtellous to glabrescent	-	glabrescent,hirtellous	narrowly lanceolate, apically long-attenuate	attenuate,lanceolate,narrow	corolla 	-	light violet	-	-	violet	pubescent without	-	-	-	-	-	9 mm long	-	-	-	-	-	-	-	-	-	-	-	-	2 x 0.8-1 mm	elliptic	elliptic	-	-	-	-	-	-	-	-	-	0.6 mm long	-	-	-	-	-	-	-	-	-	-	-	-	-	-	-	-	-	-	-	-	-	-	-	-	-	-	|, aquatic to subaquatic herb, 	-	-	-	-	-	Erect to spreading	-	20-30 cm	-	Inflorescence of opposite or alternate dichasia, |, |, inserted at 	-	-	-	-	-	-	-	bracteoles 	-	-	-	-	-	4 mm long	-	-	bracts subtending lateral flowers 	-	lateral	-	-	-	-	6 x 1.8-2 mm	-	glabrescent	-	-	glabrescent	ciliolate	ciliolate	spathulate	spathulate	-	-	-	-	-	-	-	-	-	-	-	-	-	-	-	-	-	-	-	-	-	-	-	-	-	-	-	-	-	-	-	-	-	     	-	-	-	-	-	-	-	-	-	-	-	-	-	-	-	-	-	-	-	-	-	-	-	-	-	-	-	-	-	-	-	-	-	-	-	-	-	-	-	-	-	-	-	-	-	-	-	-	-	-	-	-	-	-	-	-	-	-	-	Stem |, |, inconspicuously lenticellate. 	-	-	sparingly hirsute	-	hirsute	-	-	obtusely quadrangular and deeply sulcate	obtuse	-	-	-	-	-	-	-	-	-	
JUSTICIA  	-	-	-	-	-	-	-	-	-	-	-	-	-	-	-	-	-	-	-	-	-	-	-	-	-	-	-	-	-	-	-	-	-	-	-	-	-	-	-	-	-	-	-	-	-	-	-	-	-	-	-	-	-	-	-	-	-	-	-	-	-	-	-	-	-	-	-	-	-	-	-	-	-	-	-	-	-	-	-	-	-	-	-	-	-	     	-	-	-	-	-	-	-	-	-	-	-	-	-	-	-	-	retinacula present, septa with retinacula remaining attached to inner wall of mature capsule; 	-	mat	-	-	-	-	-	-	-	-	-	-	-	2-4	variable, spheroidal to diskoid, occasionally reniform or obcordate	cordate,reniform	-	-	-	-	-	-	-	-	-	-	Flowers homostylous, |, sessile or pedicellate; |, |, |, usually lacking a distinct throat, |, corolla lobes imbricate in bud; |, inserted at various positions in corolla tube, exserted from mouth of corolla, |, exine usually reticulate; 	sessile	-	exserted	-	reticulate	-	-	-	-	-	-	-	-	-	-	-	-	-	-	corolla 	-	greenish, white, pinkish, red, or purplish, usually with white or colored markings on ridged palate of lower lip	-	-	colored,green,pinkish,white	-	-	-	-	-	-	-	limb strongly zygomorphic, bilipped, 	bilipped	-	-	-	-	-	-	-	-	-	-	-	-	-	-	-	-	-	-	cylindric to expanded distally	cylindric	-	-	-	-	-	-	stamens 	-	-	-	-	-	-	-	-	-	-	thecae equal or unequal in length, equally or unequally inserted or superposed, 	-	-	-	-	-	-	-	-	-	-	-	Herbaceous or shrubby perennials. 	shrub	-	-	-	-	-	-	-	-	Inflorescences of dichasia in |, subtended by a leaf or a bract, sessile or pedunculate; |, prominent or inconspicuous, margins entire (in the Guianas). 	sessile	-	-	entire	-	-	-	-	-	-	-	-	-	-	-	-	bracts alternate or opposite, various, small and distant, 	small	-	-	green or brightly colored	-	colored,green	-	-	-	-	-	-	-	-	linear or subulate to large	large,linear,subulate	-	-	-	-	-	-	-	-	-	-	-	-	-	-	axillary and terminal	-	axillary,terminal	-	-	-	-	-	-	-	-	-	-	-	-	-	-	-	-	     	-	-	-	blades 	-	-	-	cystoliths present, 	-	-	-	-	-	-	ovate to oblong	oblong,ovate	-	-	-	-	-	-	-	-	-	-	-	-	-	-	-	-	-	-	-	-	-	-	-	-	-	-	-	-	-	-	-	-	-	-	-	-	-	-	-	-	-	-	-	Stems decumbent or 	-	-	-	-	-	-	-	terete to quadrate	quadrate,terete	-	-	-	-	-	-	-	-	-	
Justicia betonica 	-	-	-	-	-	-	-	-	-	-	-	-	-	-	-	-	-	-	-	-	-	-	-	-	-	-	-	-	-	-	-	-	-	-	-	-	-	-	-	-	-	-	-	-	-	-	-	-	-	-	-	-	-	-	-	-	-	-	-	-	-	-	-	-	-	-	-	-	-	-	-	-	-	-	-	-	-	-	-	-	-	-	-	-	-	Capsule |, |, often with a slight medial constriction	-	-	-	-	-	ovoid to subspheric to ellipsoid-obovoid, 	ellipsoid,ovoid,subspheric	-	-	14-16 x 4-5 x 3-5 mm	-	-	-	-	-	-	-	-	-	-	brown	brown	-	2-2.5 x 2-3 x 1.5-2 mm	glabrous	-	-	glabrous	-	-	4	subspheric	subspheric	-	-	densely rugose when dry, smooth when fully ripened	-	rugose,smooth	densely	-	-	-	5-6 mm long	     	-	-	-	-	-	-	-	-	-	-	5-5.5 mm long	lobes equal, 	-	-	-	-	-	linear-lanceolate, 	lanceolate,linear	corolla 	-	white-rose spotted to lavender-pink	-	-	lavender,pink,rose,white	pubescent without	-	-	-	-	-	11-16 mm long	-	-	-	all 	-	-	-	narrowly ovate and apically rounded to truncate	narrow,ovate,rounded,truncate	spreading	-	5-7 mm long	4-5 x 2.5-4 mm	-	-	-	-	2-4 mm in diam.	-	7-9 mm long	-	-	-	4-7 mm long	0.75-1 mm long	narrowly ovate	narrow,ovate	-	stamens 	-	-	-	-	-	-	-	-	exserted 4-5 mm beyond mouth of corolla tube	exserted	anther thecae subequal, subparallel, unequally inserted, 	parallel	-	-	-	proximally pubescent	-	-	10-11 mm long	-	-	-	Herbaceous or clumping herb 	-	-	-	-	-	-	-	to 1 m tall	-	Inflorescence |, |, |, both surfaces glabrous or nearly so|, similar to bracts. 	-	-	-	-	glabrous	-	-	bracteoles 	-	0.8-12 x 4.5-5 mm	-	-	-	-	-	-	bracts imbricate, 	-	-	-	white with green venation	-	green,white	10-15 x 8 mm	-	-	-	-	-	ciliolate, 	ciliolate	ovate-lanceolate	lanceolate,ovate	-	-	-	-	-	-	-	-	-	-	-	-	-	1.5-2 cm long	terminal and often axillary	-	axillary,terminal	-	rachis 	densely puberulous	-	densely,puberulous	-	-	-	Young stem |, sparingly branched, 	branched	glabrous, tips minutely pubescent	minute	glabrous,minutely pubescent	minute	subquadrate to terete	subquadrate,terete	-	-	-	-	-	-	-	-	-	-	-	-	-	-	-	-	-	-	Petiole |, |, both surfaces punctate not lineolate, 	-	-	-	-	blade 	-	-	-	7.5-13 x 4.5-6 cm (the lowermost sometimes much larger)	large	-	-	-	-	-	-	-	glabrous	glabrous	entire	entire	-	acute to short-acuminate at apex, shortly attenuate at base	acuminate,acute,attenuate,short	ovate to lanceolate	lanceolate,ovate	-	-	-	-	-	-	-	0.8-6 cm long	primary vein and secondary veins (	-	-	-	-	-	ca. 6 pairs	-	-	-	-	-	-	-	-	-	-	-	-	-	-	-	-	-	-	-	
Justicia calycina 	Calyx |, |, tapering into a long point|, slightly curved, |, |, bilobed, |, |, |, both about same height at base, |, much wider than ovary; 	curved,wide	-	-	-	-	-	-	-	brick red	-	-	brick red	glabrous	-	-	glabrous	-	50-60 mm long	-	-	-	-	-	tubiform	-	-	-	-	-	-	-	-	subglabrous or puberulous	-	-	glabrous,puberulous	-	-	-	-	-	-	-	-	-	-	-	-	-	-	-	-	-	-	-	-	-	-	-	-	-	-	-	linear, 	linear	-	-	-	-	-	-	50 mm long	stamens 	-	-	glabrous	-	glabrous	inserted about 5 mm below mouth of corolla	-	-	-	-	-	Capsule |, |, slightly sulcate at back, both seeds inserted at same height, |, 	-	-	-	-	-	-	-	-	-	-	glabrous	-	glabrous	-	-	14 mm long	retinacula with a distinct geniculum; 	-	-	-	-	-	-	3.2 x 2.8 mm	-	-	-	-	-	-	2	ovoid	ovoid	-	-	fairly thick	-	thick	-	-	-	-	8 mm long	-	-	-	-	-	-	-	-	-	-	-	-	-	-	-	-	-	-	-	-	-	-	-	-	-	-	-	-	-	-	-	-	-	-	-	-	-	-	-	-	-	-	-	-	-	-	-	-	-	-	-	-	-	-	-	-	-	-	-	-	-	-	-	-	-	-	-	-	-	-	-	-	-	-	-	-	-	-	-	-	-	-	-	-	Erect herb, 	-	-	-	-	-	-	-	80-100 cm tall	-	Inflorescence spike-like racemes, latter in a large, rather dense |, |, other ones |, empty bracts much narrower, but nearly as long as fertile bracts	large,narrow	-	-	-	dense	-	-	-	-	-	-	-	-	-	-	-	-	-	-	-	-	-	-	-	-	-	-	-	-	-	-	-	-	-	flowers borne secund; 	-	-	-	-	glabrous	-	glabrous	0.6 mm long	-	-	-	12-18 cm long	terminal	-	terminal	-	-	-	-	-	-	-	-	-	-	-	-	-	-	-	-	Leaves sometimes ternate, sessile, but contracted into a pseudo-petiole towards base, |, caudate, |, |, but sometimes difficult to see. 	sessile	-	-	blade 	-	-	-	cystoliths 	-	glabrous or puberulous on lower surface on primary and secondary veins (	glabrous,puberulous	-	-	-	lanceolate	lanceolate	-	-	-	-	-	-	-	-	-	-	-	-	-	-	-	-	-	-	-	-	-	-	-	-	-	-	-	-	-	-	-	-	-	-	-	-	-	-	-	-	-	-	-	-	-	-	-	-	-	-	-	-	-	frequent in secondary vegetation along streams in deciduous forests or tall riparian swamp forests, 	forest,secondary vegetation,swamp	-	-	-	-	-	100-650 m	-	
Justicia carthaginensis 	-	-	-	-	-	-	-	-	-	-	-	-	-	-	-	-	-	-	-	-	-	-	-	-	-	-	-	-	-	-	-	-	-	-	-	-	-	-	-	-	-	-	-	-	-	-	-	-	-	-	-	-	-	-	-	-	-	-	-	-	-	-	-	-	-	-	-	-	-	-	-	-	-	-	-	-	-	-	-	-	-	-	-	-	-	Capsule |, |, often with a slight medial constriction; 	-	-	-	-	-	ovoid to subspheric to ellipsoid-obovoid	ellipsoid,ovoid,subspheric	-	-	10-18 x 6 x 3 mm	puberulous	-	puberulous	-	-	-	-	-	-	-	nitid	nitid	-	3-3.5 x 3-3.3 x 1.7-2 mm	puberulous, when mature glabrous	-	-	glabrous,puberulous	mat	-	4	subspheric	subspheric	-	-	smooth	-	smooth	-	-	-	-	3-8 mm long	     	-	-	-	-	-	-	-	-	-	-	7-12 mm long	lobes equal, 	-	6.5-11 x 1-1.5 mm	glabrous or hirtellous, and margin ciliate	-	ciliate,glabrous,hirtellous	lanceolate	lanceolate	corolla 	-	violet to reddish to purple, rarely white	-	-	purple,reddish,violet,white	pubescent without	-	-	-	-	-	(14-)17-34 mm long	-	-	-	-	-	-	-	-	-	spreading	-	8-17 mm long	4.5-5 x 3-8 mm	ovate and apically rounded	ovate,rounded	-	-	1.5-4.5 mm in diam.	-	(6-)8-18 mm long	-	-	-	7.5-13 mm long	1.3-2.3 mm long	triangular-ovate	ovate	-	stamens 	-	-	-	-	-	-	-	-	exserted 5 mm beyond mouth of corolla tube	exserted	anther thecae subequal, subparallel, unequally inserted, 	parallel	-	-	-	proximally pubescent	-	-	13-22 mm long	-	-	-	-	-	-	-	-	-	Erect to spreading	-	to 1.5 m tall	-	Inflorescence of dichasia in axils of distal leaves or usually in axils of bracts forming a |, sessile, dichasiate spike, |, sessile; |, apically acute to truncate|, apically rounded to truncate	acute,rounded,sessile,truncate	-	-	-	-	-	-	bracteoles 	-	-	pubescence similar to that of bracts	-	-	-	oblanceolate to spathulate, 	oblanceolate,spathulate	bracts opposite, proximal bracts often foliose, those near midspike petiolate, 	-	-	-	-	-	-	-	-	subglabrous to moderately hirtellous and ciliate	-	-	ciliate,glabrous,hirtellous	-	-	elliptic to obovate to spathulate, 	elliptic,obovate,spathulate	9-16 x 2.5-6.5 mm	-	-	-	-	2-7 cm long (excluding flowers)	-	-	-	-	-	-	-	-	terminal	-	terminal	-	rachis 	pubescent	-	-	-	-	-	Young stem 	-	(± evenly to) bifariously pubescent, soon glabrate	-	glabrate	-	subquadrate to quadrate-multistriate to ± flattened	flattened,striate,subquadrate	-	-	-	-	-	-	-	-	-	-	-	-	-	-	-	-	-	-	Petiole |, 	-	-	-	-	blade 	-	-	-	2-13.5 x 1.5-5 cm	-	-	-	-	-	-	-	-	both surfaces glabrous or with trichomes along major veins	glabrous,trichomes	entire	entire	-	acute to acuminate at apex, acute to attenuate at base	acuminate,acute,attenuate	lanceolate to ovate to elliptic-ovate	elliptic,lanceolate,ovate	-	-	-	-	-	-	-	to 20 mm long	-	-	-	-	-	-	-	-	-	-	-	-	-	-	-	-	-	slopes, in waste places, thickets, these occasionally coastal, and in disturbed secondary growth forests, 	forest	-	thick	-	-	-	although more common at lower altitudes, it has been found as high as 1300 m	-	
Justicia cayennensis 	-	-	-	-	-	-	-	-	-	-	-	-	-	-	-	-	-	-	-	-	-	-	-	-	-	-	-	-	-	-	-	-	-	-	-	-	-	-	-	-	-	-	-	-	-	-	-	-	-	-	-	-	-	-	-	-	-	-	-	-	-	-	-	-	-	-	-	-	-	-	-	-	-	-	-	-	-	-	-	-	-	-	-	-	-	Capsule |, 	-	-	-	-	-	-	-	-	-	7 x 2 x 1 mm	puberulent	-	puberulent	-	-	-	-	-	-	-	brown	brown	-	1 x 1.25 mm	-	-	-	-	-	-	4	lenticular	lenticular	-	-	-	-	-	-	clavate	clavate	-	2-2.5 mm long	     	-	-	-	-	-	-	-	-	-	-	-	-	-	-	-	-	-	-	-	corolla 	-	violet, marked with lighter streaks on lower lip	-	-	violet	puberulous	-	-	puberulous	-	-	10-12 mm long	-	-	-	-	-	-	-	-	-	-	-	-	-	-	-	obovate	obovate	-	-	-	-	-	5-5.5 x 2 mm	-	-	-	-	-	stamens 	-	-	-	-	-	-	-	-	exserted ca. 2 mm beyond mouth of corolla tube	exserted	anther thecae 	-	0.4 mm long	-	-	-	-	-	-	-	-	-	Erect perennial herb, 	-	-	-	-	-	-	-	0.3-0.5 m tall	-	Inflorescence |, subsessile or pedunculate spikes, |, |, |, 	subsessile	-	-	-	-	-	-	bracteoles 	-	4-5 x 0.5 mm	glabrate	-	glabrate	-	linear	linear	bracts decussate, 	-	-	-	green	-	green	4-5 x 1.5-2 mm	-	glabrous or minutely puberulous	minute	-	glabrous,puberulous	ciliate	ciliate	lanceolate to narrowly ovate	lanceolate,narrow,ovate	-	flowers borne either in superposed pairs or solitary and accompanied by a rudiment of a second flower in axils of bracts; 	-	-	-	2-9 cm long	-	-	-	-	-	-	-	-	terminal and axillary	-	axillary,terminal	-	-	-	-	-	-	-	-	-	-	-	-	-	-	-	-	-	-	-	-	-	-	-	-	-	-	-	-	-	-	-	-	-	-	Petiole |, 	-	-	-	-	blade 	-	-	-	(3.5-)6-11 x (1.1)1.6-4.5 cm	-	-	-	-	-	-	-	-	glabrous except primary vein and secondary veins, these appressed pubescent on lower surface	appressed pubescent,glabrous	-	-	-	acute to acuminate at apex, acute to attenuate at base	acuminate,acute,attenuate	lanceolate or lanceolate-elliptic	elliptic,lanceolate	-	-	-	-	-	-	-	2-10 mm long	-	-	-	-	-	-	-	Stems 	-	-	pubescent or ultimately glabrescent	-	glabrescent	-	-	subquadrate	subquadrate	in non-flooded moist forest and in flood plain forest	forest	-	-	-	-	-	-	-	
