Justicia prevostiae 	-	-	-	-	-	-	-	-	-	-	-	-	-	-	-	-	-	-	-	-	-	-	-	-	-	-	-	-	-	-	-	-	-	-	-	-	-	-	-	-	-	-	-	-	-	-	-	-	-	-	-	-	-	-	-	-	-	-	-	-	-	-	-	-	-	-	-	-	-	-	-	-	-	-	-	-	-	-	-	-	-	-	-	-	-	Capsule |, surface and margin covered with knoblike papillae.	-	-	-	-	-	-	-	-	-	7-7.5 x 2 x 1.5 mm	puberulous	-	puberulous	-	-	-	-	-	-	-	reddish brown	brown,reddish	-	2 x 1.75 x 1 mm	-	-	-	-	-	-	-	subspheric	subspheric	-	-	-	-	-	-	clavate	clavate	-	-	     	-	-	-	-	-	-	-	-	-	-	4-4.5 mm long	-	-	-	all glabrate or puberulous with a mixture of eglandular and glandular trichomes	-	glabrate,glandular,puberulous,trichomes	-	-	corolla 	-	white to pale mauve	-	-	mauve,white	puberulous	-	-	puberulous	-	-	11-13(-14) mm long	limb 	-	-	lobes 	-	-	-	oblong to narrowly obovate, apically rounded	narrow,oblong,obovate,rounded	± erect	erect	5.5 mm long	-	-	-	-	-	-	-	-	cylindrical, 	cylindric	5-6 x 1.5-2 mm	-	-	narrowly ovate	narrow,ovate	-	stamens 	-	-	-	filament 	-	-	-	-	exserted 3-4 mm beyond mouth of corolla	exserted	anther thecae superposed, subequal, vertically attached to connective, 	-	-	not conspicuously apiculate	apiculate	-	-	-	-	-	-	-	Erect, perennial herb or subshrub, 	subshrub	-	-	-	-	-	-	30-50 cm tall	-	Inflorescence |, lax, |, pedunculate; |, not imbricate, decussate, |, mucronulate at apex, |, |, vestiture similar to that of bract. 	-	-	-	-	-	-	-	bracteoles 	-	3.5-4 x 0.5 mm	-	-	-	-	linear	linear	bracts 	-	-	-	green	-	green	3.5-4 x 0.75 mm	-	glabrate to puberulous with both eglandular and glandular trichomes	-	-	glabrate,glandular,puberulous,trichomes	ciliolate	ciliolate	narrowly lanceolate	lanceolate,narrow	-	-	-	-	-	3.5-7 cm long	-	-	-	-	-	pilosulous	pilosulous	4-15 mm long	terminal and axillary	-	axillary,terminal	-	rachis 	pilosulous	-	pilosulous	-	-	-	-	-	-	-	-	-	-	-	-	-	-	-	-	-	-	-	-	-	-	-	-	-	-	-	-	-	Petiole short, |, entire or undulate, acute to acuminate at apex, acute to attenuate at base|, 	acuminate,acute,attenuate,short	-	entire,undulate	-	blade sometimes anisophyllous, firm, 	-	-	-	-	-	-	-	-	lighter green, young blades often reddish to purple on lower surface	green,purple,reddish	glabrate to puberulous	glabrate,puberulous	-	-	-	-	-	-	-	elliptic to broadly lanceolate to narrowly ovate, 	elliptic,lanceolate,narrow,ovate	4-7 x 2-2.7 cm	-	-	pilosulous	-	pilosulous	-	3-5 mm long	-	-	-	-	-	-	-	Stem |, sulcatae, 	-	-	pilosulous	-	pilosulous	-	-	subquadrate	subquadrate	secondary vegetation on lateritic soils and in forests on terra firma at edge of streams, 	forest,secondary vegetation	-	-	-	-	-	between sea level and 550 m	-	
Justicia secunda 	-	-	-	-	-	-	-	-	-	-	-	-	-	-	-	-	-	-	-	-	-	-	-	-	-	-	-	-	-	-	-	-	-	-	-	-	-	-	-	-	-	-	-	-	-	-	-	-	-	-	-	-	-	-	-	-	-	-	-	-	-	-	-	-	-	-	-	-	-	-	-	-	-	-	-	-	-	-	-	-	-	-	-	-	-	Capsule |, 	-	-	-	-	-	ovoid to subspheric	ovoid,subspheric	-	-	9-12 x 4-5 x 2-2.5 mm	puberulent	-	puberulent	-	-	-	-	-	-	-	-	-	-	2.5-3 x 2.5-3 x 0.5 mm	glabrous	-	-	glabrous	-	-	4	lenticular	lenticular	-	-	slightly roughened	-	roughened	-	-	-	-	4-5 mm long	     	-	-	-	-	-	-	-	-	-	-	6-8 mm long	lobes subequal, 	-	5-7 x 0.8-1.25 mm	glabrous to hirtellous with a mixture of glandular and eglandular trichomes	-	glabrous,glandular,hirtellous,trichomes	oblong-lanceolate	oblong-lanceolate	corolla 	-	pale red to dull crimson	-	-	crimson,red	glabrous or upper portion sparingly puberulous, some trichomes glandular	-	-	glabrous,glandular,puberulous,trichomes	-	-	30-38(-40) mm long	-	-	-	lobes 	-	-	-	ovate, 	ovate	erect or somewhat spreading	erect	20-22 mm long	-	-	-	oblong	oblong	3-5 mm in diam.	-	12-16 mm long	-	-	-	-	-	narrowly ovate, 	narrow,ovate	-	stamens 	-	-	-	-	-	-	-	-	exserted 18-24 mm beyond mouth of corolla tube	exserted	anther thecae subequal, subparallel, 	parallel	-	-	-	sparingly and minutely hirtellous	minute	hirtellous	20-28 mm long	-	-	-	Herb or 	-	-	-	-	-	scandent	scandent	0.5-3 m tall	-	Inflorescence a |, sharply acute|, |, 	acute	-	-	-	-	-	-	bracteoles 	-	1-2 x 0.25 mm	-	-	-	-	subulate	subulate	bracts subtending flowers 	-	-	-	-	-	-	-	-	-	-	-	-	-	-	subulate or narrowly triangular, 	narrow,subulate	1.5 x 0.5 mm	flowers secund and crowded or distant (	-	-	-	-	-	-	-	-	-	-	-	10-30 mm long	terminal	-	terminal	-	rachis and peduncle 	moderately puberulous	-	puberulous	-	-	-	-	-	-	-	-	-	-	-	-	-	-	-	-	-	-	-	-	-	-	-	-	-	-	-	-	-	Petiole slender, |, firm, entire or undulate, acuminate to long acuminate at apex (tip itself acute), obtuse or rounded at base, sometimes obliquely so	acuminate,acute,oblique,obtuse,rounded,slender	-	entire,undulate	-	blade 	-	-	-	-	-	both surfaces glabrous or nearly so	-	glabrous	-	-	-	-	-	-	-	-	-	-	-	ovate to oblong-ovate, 	oblong,ovate	8-15 x 2.5-6.5 cm	-	-	channel puberulous with minute curved trichomes	curved,minute	puberulous,trichomes	-	8-35 mm long	primary vein and secondary veins (	glabrous or sometimes sparingly puberulous with recurved trichomes	curved	glabrous,puberulous,trichomes	recurved	curved	6-8 pairs	Stem |, shallowly sulcate, 	-	-	at least above glabrous or sparingly puberulous	-	glabrous,puberulous	-	-	obtusely quadrangular	obtuse	common in secondary vegetation in partial shade, especially along roads in forest	forest,secondary vegetation	-	-	-	-	-	-	-	
Justicia sphaerosperma 	-	-	-	-	-	-	-	-	-	-	-	-	-	-	-	-	-	-	-	-	-	-	-	-	-	-	-	-	-	-	-	-	-	-	-	-	-	-	-	-	-	-	-	-	-	-	-	-	-	-	-	-	-	-	-	-	-	-	-	-	-	-	-	-	-	-	-	-	-	-	-	-	-	-	-	-	-	-	-	-	-	-	-	-	-	Capsule |, |, often with a slight medial constriction	-	-	-	-	-	ovoid to subspheric to ellipsoid-obovoid, 	ellipsoid,ovoid,subspheric	-	-	12-14 x 5-6 x 4-5 mm	-	-	-	-	-	-	-	-	-	-	light brown	brown	-	2.5 x 2.5 x 1.75 mm	puberulous, when mature glabrous, smooth and nitid	-	smooth	glabrous,puberulous	mat	nitid	4	subspheric	subspheric	-	-	-	-	-	-	-	-	-	5-6 mm long	     	-	-	-	-	-	-	-	-	-	-	-	lobes 	-	10-12.5 x 1.5-1.75 mm	densely puberulent, trichomes appressed	-	densely,puberulent,trichomes	linear-lanceolate	lanceolate,linear	corolla 	-	red, pink, pink-salmon or light pinkish-red	-	-	pink,red	-	-	-	-	-	-	-	-	-	-	lobes subequal, 	-	-	-	oblong-linear, 	linear,oblong	spreading	-	15 mm long	-	-	-	-	-	-	-	20 mm long	-	-	-	12-14 mm long	-	narrowly ovate	narrow,ovate	-	stamens 	-	-	-	filaments 	-	-	-	-	exserted 10-12 mm beyond mouth of corolla tube	exserted	anther thecae 	-	-	-	-	glabrous	-	glabrous	25-40 mm long	-	-	-	Woody climber, 	-	-	-	-	-	-	-	0.35-3 m tall	-	Inflorescence a |, this imbricate from a leafy base	-	-	-	-	-	-	-	-	-	-	-	-	-	-	-	-	-	-	-	-	-	-	-	-	-	-	-	-	-	-	-	-	-	-	-	-	-	-	-	-	-	-	-	-	-	-	-	terminal	-	terminal	-	-	-	-	-	-	-	-	-	-	-	-	-	-	-	-	-	-	-	-	-	-	-	-	-	-	-	-	-	-	-	-	-	-	Petiole |, 	-	-	-	-	blade rather firm, 	-	-	-	6-15 x 1.25-3.5 cm	-	-	-	-	-	-	-	-	sparingly pubescent on both surfaces, especially on primary vein and secondary veins (	-	entire	entire	-	acuminate at apex, acute to attenuate at base	acuminate,acute,attenuate	lanceolate	lanceolate	-	-	-	puberulous, trichomes antrorsely appressed	-	puberulous,trichomes	-	5 mm long	primary vein and secondary veins prominent on lower surface, obscure on upper surface,       	-	-	-	-	-	-	Stem |, slightly sulcate, 	-	-	glabrous to sparingly puberulous, trichomes retrorsely curved	curved	glabrous,puberulous,trichomes	-	-	subterete	subterete	infrequent in riverine forests on sandy soils, wet savannas and gallery forests, 	riverine forest	-	-	-	-	-	60-200 m	-	
Justicia sprucei 	-	-	-	-	-	-	-	-	-	-	-	-	-	-	-	-	-	-	-	-	-	-	-	-	-	-	-	-	-	-	-	-	-	-	-	-	-	-	-	-	-	-	-	-	-	-	-	-	-	-	-	-	-	-	-	-	-	-	-	-	-	-	-	-	-	-	-	-	-	-	-	-	-	-	-	-	-	-	-	-	-	-	-	-	-	Capsule |, 	-	-	-	-	-	ovoid to subspheric to ellipsoid-obovoid	ellipsoid,ovoid,subspheric	brown	brown	15 x 5 x 4.5 mm	puberulent	-	puberulent	-	-	-	-	-	-	-	dark brown and nitid	brown,nitid	-	3.5 x 3 mm	when mature glabrous	-	-	glabrous	mat	-	4	lenticular	lenticular	-	-	smooth	-	smooth	-	clavate	clavate	-	6 mm long	     	-	-	-	-	-	-	-	-	-	-	-	lobes subequal, 	-	10 x 1.5 mm	-	-	-	lanceolate	lanceolate	corolla 	-	white	-	-	white	-	-	-	-	-	-	35 mm long	-	-	-	all 	-	-	-	apically rounded	rounded	erect to spreading	erect	11 mm long	-	-	-	-	-	-	-	25 mm long	-	-	10 x 6 mm	-	-	narrowly ovate	narrow,ovate	-	stamens 	-	-	-	-	-	-	-	-	exserted 10 mm beyond mouth of corolla tube	exserted	anther thecae subequal, unequally inserted, superposed, 	-	-	-	-	glabrous	-	glabrous	28 mm long	-	-	-	Creeping herb or subshrub, 	subshrub	-	-	-	-	-	-	0.45-1.4 m tall	-	Inflorescence |, dense clusters of spikes, forming a capitulum with |, 	-	-	-	-	dense	-	-	bracteoles similar to bracts, 	-	15 x 1 mm	-	-	-	-	-	-	bracts 	-	-	-	green	-	green	16 x 2 mm	-	-	-	-	-	long-	-	lanceolate	lanceolate	-	-	-	-	-	-	-	-	-	-	-	-	-	-	terminal, sometimes axillary	-	axillary,terminal	-	-	-	-	-	-	-	-	-	-	-	-	-	-	-	-	-	-	-	-	-	-	-	-	-	-	-	-	-	-	-	-	-	-	Petiole |, |, long-attenuate at apex and base, 	attenuate	-	-	-	blade 	-	-	-	10-15 x 3-5(-6) cm	-	-	-	-	-	-	-	-	glabrous except puberulent primary vein and secondary veins on lower surface	glabrous,puberulent	entire or undulate	entire,undulate	-	-	-	oblong	oblong	-	-	-	glabrate to sparingly puberulous	-	glabrate,puberulous	-	10-20 mm long	-	-	-	-	-	-	-	Stem |, often rooting at lower nodes. 	 nodes	-	puberulous	-	puberulous	-	-	terete	terete	occasional, non-flooded moist forest, 	forest	-	-	-	-	-	200-300 m	-	
Justicia wilhelminensis 	-	-	-	-	-	-	-	-	-	-	-	-	-	-	-	-	-	-	-	-	-	-	-	-	-	-	-	-	-	-	-	-	-	-	-	-	-	-	-	-	-	-	-	-	-	-	-	-	-	-	-	-	-	-	-	-	-	-	-	-	-	-	-	-	-	-	-	-	-	-	-	-	-	-	-	-	-	-	-	-	-	-	-	-	-	Capsule 	-	-	-	-	-	-	-	-	-	9-10 x 3 x 2 mm	puberulous	-	puberulous	-	-	-	-	-	-	-	dark reddish brown	brown,dark reddish	-	2.5 x 2 x 1 mm	surface and margin glabrous or covered with knoblike papillae	-	-	glabrous	-	-	-	lenticular to subspheric	lenticular,subspheric	-	-	-	-	-	-	clavate	clavate	-	-	     	-	-	-	-	-	-	-	-	-	-	7 mm long	lobes subequal, 	-	5-6 x 1 mm	sparingly hirtellous	-	hirtellous	narrowly triangular	narrow,triangular	corolla 	-	pale lavender	-	-	lavender	-	-	-	-	-	-	9-10 mm long	-	-	-	lobes 	-	-	-	oblong to narrowly obovate, delicately veined, rounded	narrow,oblong,obovate,rounded	spreading to erect	erect	3-4 mm long	-	-	-	-	-	1-1.25 mm in diam. at base, slightly enlarged to 2 mm at 	large	6 mm long	cylindrical	cylindric	3-4 x 2.5 mm	-	-	narrowly ovate to triangular	narrow,ovate	-	stamens 	-	-	-	filaments 	-	-	-	-	exserted 4 mm beyond mouth of corolla	exserted	anther thecae superposed, subequal, vertically attached to connective, both thecae 	-	-	apiculate	apiculate	-	-	-	-	-	-	-	Herb or subshrub 	subshrub	-	-	-	-	-	-	to 75 cm tall	-	Inflorescence |, |, 	-	-	-	-	-	-	-	bracteoles subequal, 	-	8-9 x 1.5 mm	densely hirtellous	-	densely,hirtellous	-	narrowly spathulate	narrow,spathulate	bract decussate imbricate, 	-	-	-	reddish brown when dry	-	brown,reddish	9-11 x 2-2.5 mm	-	densely hirtellous with both eglandular and glandular trichomes	-	-	densely,glandular,hirtellous,trichomes	ciliolate	ciliolate	-	-	-	-	-	-	-	2-6 cm long	-	-	-	-	-	densely puberulous	densely,puberulous	10-12 mm long	terminal and axillary	-	axillary,terminal	-	rachis 	densely puberulous	-	densely,puberulous	-	-	-	-	-	-	-	-	-	-	-	-	-	-	-	-	-	-	-	-	-	-	-	-	-	-	-	-	-	Petiole |, entire or somewhat undulate, acute to acuminate at apex, attenuate at base|, 	acuminate,acute,attenuate	-	entire,undulate	-	blade firm, 	-	-	-	-	-	-	-	-	lighter green when dry	green	both surfaces glabrous except on veination puberulent with sordid trichomes	glabrous,puberulent,trichomes	-	-	-	-	-	-	-	oblong to lanceolate, 	lanceolate,oblong	9-12 x 2.5-3.5 cm	-	-	puberulous	-	puberulous	-	10-20 mm long	primary and secondary veins (	-	-	-	-	-	4-6 pairs	Stem |, ascending, 	-	ascending	densely puberulent	-	densely,puberulent	-	-	quadrangular	quadrangular	common in low mossy forest	forest,moss	-	-	-	-	-	-	-	
LEPIDAGATHIS  	-	-	-	-	-	-	-	-	-	-	-	-	-	-	-	-	-	-	-	-	-	-	-	-	-	-	-	-	-	-	-	-	-	-	-	-	-	-	-	-	-	-	-	-	-	-	-	-	-	-	-	-	-	-	-	-	-	-	-	-	-	-	-	-	-	-	-	-	-	-	-	-	-	-	-	-	-	-	-	-	-	-	-	-	-	Capsules estipitate, |, 	stipitat	-	-	-	-	-	-	-	-	-	-	-	-	-	-	-	retinacula present, septa with retinacula remaining attached to inner wall of mature capsule; 	-	mat	-	-	-	-	-	pubescent with hygroscopic trichomes	-	-	trichomes	-	-	2-4	homomorphic, lenticular	lenticular	-	-	-	-	-	-	subovoid to subellipsoid	subellipsoid,subovoid	-	-	     	-	-	-	-	-	-	-	-	-	-	-	lobes heteromorphic, 	-	-	-	-	-	-	-	corolla 	-	whitish, yellow, pink, or purplish	-	-	pink,purplish,whitish	-	-	-	-	-	-	-	limb bilipped, 	bilipped	-	corolla lobes imbricate in bud; 	-	-	-	-	-	-	-	-	-	-	-	-	-	-	-	-	cylindric or gradually expanded distally into a throat	cylindric	-	-	-	-	-	-	stamens 	-	-	-	-	-	-	-	-	-	-	thecae subequal to subparallel, equal to unequal inserted, unappendaged or 	parallel	-	-	-	-	-	-	-	-	-	-	Decumbent or 	-	-	-	-	-	spreading to erect	erect	-	-	Inflorescences of |, densely bracteate dichasiate spikes, spikes solitary or clustered, |, sessile or subsessile, subtended by a bract; 	sessile	-	-	-	densely	-	-	bracteoles 	-	-	-	-	-	-	-	-	bracts opposite, 	-	-	-	green, ± hyaline, or colored	-	colored,green	-	-	often spinose-aristate at apex	-	spinose	-	-	-	-	-	-	-	-	-	-	-	-	-	-	-	-	-	-	-	axillary or terminal	-	axillary,terminal	-	-	-	-	-	-	elongate and cylindric to secund or nearly globose and appearing subcapitate	cylindric,elongate,globose,subcapitate	-	-	-	-	-	-	-	-	     	-	-	-	blades 	-	-	-	with numerous 	-	-	-	entire	entire	-	ovate to lanceolate	lanceolate,ovate	-	-	-	-	-	-	-	-	-	-	-	-	-	-	-	-	-	-	-	-	-	-	-	-	-	-	-	-	-	-	-	-	-	-	-	-	-	-	-	-	-	-	-	-	-	-	-	-	-	-	-	-	-	-	-	-	-	-	-	-	-	-	
Lepidagathis alopecuroidea 	-	-	-	-	-	-	-	-	-	-	-	-	-	-	-	-	-	-	-	-	-	-	-	-	-	-	-	-	-	-	-	-	-	-	-	-	-	-	-	-	-	-	-	-	-	-	-	-	-	-	-	-	-	-	-	-	-	-	-	-	-	-	-	-	-	-	-	-	-	-	-	-	-	-	-	-	-	-	-	-	-	-	-	-	-	Capsule 	-	-	-	-	-	-	-	-	-	-	pubescent near apex with erect to flexuose, eglandular trichomes	-	glandular,trichomes	erect	-	3.5-4.5 mm long	-	-	-	-	-	-	-	1-1.2 x 0.9-1 mm	-	-	-	-	-	-	4	-	-	-	-	-	-	-	-	-	-	-	-	     	-	-	-	-	-	-	-	-	-	-	3.5-7 mm long	-	-	-	-	-	-	-	-	corolla 	-	white with irregular pink markings on lower lip	-	regular	pink,white	-	-	-	-	-	-	4.5-6 mm long	limb externally 	-	-	-	-	-	-	-	-	-	-	1.8-2 mm long	1.2-1.3 x 1-1.2 mm	subcircular	subcircular	-	-	-	-	2.5-4 mm long	cylindric	cylindric	-	1.5-2 mm long	0.1-0.2 mm long	-	-	-	stamens 	-	-	-	-	-	-	-	-	-	-	thecae 	-	0.3-0.4 mm long	-	-	proximally pubescent with eglandular trichomes	-	glandular,trichomes	3-3.5 mm long	-	-	-	Reclining to ascending, perennial herb 	-	-	-	ascending	-	-	-	30-50 cm tall	-	Inflorescence of |, sessile to pedunculate, |, sessile; |, prominently |, 	sessile	-	-	-	-	-	-	bracteoles 	-	3-7 x 0.5-1.5 mm	aristate at apex, usually venose, abaxial surface pubescent like bracts	-	-	-	lanceolate to narrowly elliptic to oblanceolate	elliptic,lanceolate,narrow	bracts 	-	-	-	-	-	-	5-8 x 1.5-3 mm	-	abaxial surface pubescent with flexuose to flexuose-antrorse eglandular and inconspicuous glandular trichomes	-	-	glandular,trichomes	-	-	obovate	obovate	-	-	-	-	-	-	-	-	-	-	-	-	-	to 4 mm long	terminal	-	terminal	-	rachis not or hardly visible; 	-	-	-	-	cylindric	cylindric	Young stem 	-	bifariously pubescent with flexuose-antrorse eglandular trichomes	-	glandular,trichomes	-	subquadrate	subquadrate	-	-	-	-	-	-	-	-	-	-	-	-	-	-	-	-	-	-	Petiole |, acute to obtuse at apex, acute to attenuate at base	acute,attenuate,obtuse	-	-	-	blade 	-	-	-	-	-	both surfaces nearly glabrous with trichomes restricted to primary and secondary veins and margin	-	glabrous,trichomes	-	-	-	-	-	-	-	-	-	-	-	ovate-elliptic to elliptic to obovate-elliptic, 	elliptic,ovate	1.5-8 x 0.8-3 cm	-	-	-	-	-	-	to 20 mm long	-	-	-	-	-	-	-	-	-	-	-	-	-	-	-	-	-	occurs in moist areas along trails in rainforests, thickets and fields	forest	-	thick	-	-	-	-	-	
Lepidagathis cataractae 	-	-	-	-	-	-	-	-	-	-	-	-	-	-	-	-	-	-	-	-	-	-	-	-	-	-	-	-	-	-	-	-	-	-	-	-	-	-	-	-	-	-	-	-	-	-	-	-	-	-	-	-	-	-	-	-	-	-	-	-	-	-	-	-	-	-	-	-	-	-	-	-	-	-	-	-	-	-	-	-	-	-	-	-	-	Capsule 	-	-	-	-	-	-	-	light brownish	brown	-	dorsally pubescent with erect to flexuouse eglandular trichomes	-	glandular,trichomes	erect	-	2.5-3 mm long	-	-	-	-	-	-	-	0.9-1 x 0.6-0.8 mm	-	-	-	-	-	-	4	-	-	-	-	-	-	-	-	-	-	-	-	     	-	-	-	-	-	-	-	-	-	-	3.5-5 mm long	-	-	-	-	-	-	-	-	corolla 	-	white or lavender with violet lines on lower lip	-	-	lavender,violet,white	-	-	-	-	-	-	6-6.5 mm long	limb externally 	-	-	-	-	-	-	-	-	-	-	2.5-3 mm long	1.5-2 x 1-1.2 mm	obovate	obovate	-	-	-	-	2-2.5 mm long	cylindric	cylindric	-	2.5-3 mm long	0.4-0.5 mm long	-	-	-	stamens 	-	-	-	-	-	-	-	-	-	-	thecae 	-	0.3-0.5 mm long	-	-	proximally glabrous	-	glabrous	4-4.2 mm long	-	-	-	Reclining to ascending perennial herb 	-	-	-	ascending	-	-	-	to 25 cm tall	-	Inflorescence of |, sessile to pedunculate, |, densely bracteate, |, sessile; |, acute to mucronate at apex|, prominently |, usually venose, |, 	acute,sessile	-	-	-	densely	-	-	bracteoles sometimes asymetrical, 	-	3 x 0.5 mm	abaxial surface glabrous to sparingly pubescent like bracts	-	glabrous	-	narrowly elliptic	elliptic,narrow	bracts 	-	-	-	-	-	-	-	-	abaxial surface sparingly pubescent with flexuose to flexuose-antrorse, eglandular and inconspicuous glandular trichomes	-	-	glandular,trichomes	-	-	narrowly elliptic, 	elliptic,narrow	4.5-8 x 0.8-3 mm	-	-	-	-	-	-	-	-	-	-	-	-	to 2 mm long	terminal	-	terminal	-	rachis if visible, 	sparingly puberulous	-	puberulous	-	cylindric	cylindric	-	-	-	-	-	-	-	-	     	-	-	-	blade 	-	-	-	-	-	both surfaces nearly glabrous with pubescence, if present, restricted to primary and secondary veins (	glabrous	-	-	-	oblong to elliptic, 	elliptic,oblong	2-3.5 x 0.5-0.8 cm	-	-	-	-	-	-	-	-	-	-	-	-	-	-	-	-	-	-	-	-	-	-	-	-	-	-	-	-	-	-	-	-	-	-	-	-	-	-	-	-	-	-	Stem |, narrowly winged, 	narrow,winged	-	sparingly pubescent with small, flexuose-antrose, eglandular trichomes	small	glandular,trichomes	-	-	quadrangular	quadrangular	forming colonies in shallow water or along rocky or sandy river banks, flowering as river recedes	rock	-	-	-	-	-	-	-	
Lepidagathis gracilis 	-	-	-	-	-	-	-	-	-	-	-	-	-	-	-	-	-	-	-	-	-	-	-	-	-	-	-	-	-	-	-	-	-	-	-	-	-	-	-	-	-	-	-	-	-	-	-	-	-	-	-	-	-	-	-	-	-	-	-	-	-	-	-	-	-	-	-	-	-	-	-	-	-	-	-	-	-	-	-	-	-	-	-	-	-	Capsule 	-	-	-	-	-	-	-	-	-	-	pubescent near apex with erect to flexuose eglandular trichomes	-	glandular,trichomes	erect	-	4 mm long	-	-	-	-	-	-	-	-	-	-	-	-	-	-	-	-	-	-	-	-	-	-	-	-	-	-	-	     	-	-	-	-	-	-	-	-	-	-	5 mm long	-	-	-	-	-	-	-	-	corolla 	-	whitish with brown streaks on lower lip	-	-	brown,whitish	-	-	-	-	-	-	5.5-6 mm long	limb 	-	-	-	-	-	-	-	-	-	-	2.5-3 mm long	1.2-2 x 1-1.2 mm	oblong	oblong	-	-	-	-	3.5 mm long	cylindric	cylindric	-	2.25-2.5 mm long	0.4-0.5 mm	-	-	-	stamens 	-	-	-	-	-	-	-	-	-	-	thecae 	-	0.4-0.5 mm long	-	-	glabrous	-	glabrous	4 mm long	-	-	-	Herb, 	-	-	-	-	-	-	-	15-25 cm tall	-	Inflorescence of |, sessile to pedunculate, |, |, lowermost sessile, subtended by a pair of reduced cauline leaves, remainder subtended by bracts; |, prominently |, |, not venose, |, 	sessile	-	-	-	-	-	red	bracteoles 	-	4.5-5 x 1-1.2 mm	glabrous	-	glabrous	-	narrowly elliptic	elliptic,narrow	bracts 	-	-	-	-	-	-	5.5 x 1.8 mm	-	glabrous	-	-	glabrous	eciliate	ciliate	narrowly obovate	narrow,obovate	-	-	-	-	-	-	-	-	-	-	-	-	-	-	terminal	-	terminal	-	rachis not or hardly visible; 	-	-	-	-	cylindric	cylindric	-	-	-	-	-	-	-	-	Leaves |, apically subobtuse, acute or contracted at base, thin|, 	acute,obtuse	thin	-	blade 	-	-	-	cystoliths not readily discernible; 	-	both surfaces glabrous	glabrous	-	-	-	lanceolate, 	lanceolate	1.5-2.5 x 0.5-0.8 cm	-	-	-	-	-	-	-	-	-	-	-	-	-	-	-	-	-	-	-	-	-	-	-	-	-	-	-	-	-	-	-	-	-	-	-	-	-	-	-	-	-	-	Stem |, 	-	-	glabrous	-	glabrous	-	-	quadrate	quadrate	river banks and pond margins, in savanna	-	-	-	-	-	-	-	-	
Lepidagathis mazarunensis 	-	-	-	-	-	-	-	-	-	-	-	-	-	-	-	-	-	-	-	-	-	-	-	-	-	-	-	-	-	-	-	-	-	-	-	-	-	-	-	-	-	-	-	-	-	-	-	-	-	-	-	-	-	-	-	-	-	-	-	-	-	-	-	-	-	-	-	-	-	-	-	-	-	-	-	-	-	-	-	-	-	-	-	-	-	Capsule not seen.	-	-	-	-	-	-	-	-	-	-	-	-	-	-	-	-	-	-	-	-	-	-	-	-	-	-	-	-	-	-	-	-	-	-	-	-	-	-	-	-	-	-	-	     	-	-	-	-	-	-	-	-	-	-	3.5-5 mm long	-	-	-	-	-	-	-	-	corolla 	-	white blotched with pinkish-purple on lower lip	-	-	pinkish,purple,white	glabrous	-	-	glabrous	-	-	5.7 mm long	-	-	-	lobes of lower lip 	-	-	-	oblong, obtuse	oblong,obtuse	-	-	-	-	-	-	-	-	0.9 mm in diam.	-	2.2 mm long	cylindric	cylindric	-	-	-	lanceolate, obtuse	lanceolate,obtuse	-	stamens 	-	-	0.4 mm long	filaments 	-	-	-	1.3 and 2 mm long respectively	inserted 0.2 mm below mouth of corolla	-	thecae 	-	0.3 mm long	somewhat apiculate at base	apiculate	glabrous	-	glabrous	3 mm long	-	-	-	Creeping herb, 	-	-	-	-	-	-	-	6-13 cm tall	-	Inflorescence of |, sessile to pedunculate, |, not confluent spikes, |, |, acute and callus mucronulate at apex|, acute at apex	acute,sessile	-	-	-	-	-	-	bracteoles 	-	-	sparsely ciliate	-	ciliate	-	linear, suboblique, 	linear,suboblique	bracts 	-	-	-	-	-	-	-	-	sparsely ciliate	-	-	ciliate	-	-	obovate, 	obovate	3.5-6 x 1.6-2.2 mm	-	-	-	-	1-2.5 cm long	-	-	-	-	-	-	-	-	terminal	-	terminal	-	rachis not or hardly visible, 	ciliate	-	ciliate	-	cylindric	cylindric	-	-	-	-	-	-	-	-	Leaves contracted into a winged petiole |, obtuse|, |, sometimes conspicuously lineolate on upper surface; 	obtuse,winged	-	-	blade 	-	-	-	cystoliths 	-	-	-	-	-	-	narrowly elliptic to lanceolate, 	elliptic,lanceolate,narrow	7-18 x 4-8 mm	-	-	-	-	-	-	-	-	-	-	-	-	-	-	-	-	-	-	-	-	-	-	-	-	-	-	-	-	-	-	-	-	-	-	-	-	-	-	-	-	-	-	Stem rooting at base, |, narrowly winged, |, 	narrow,winged	-	glabrous	-	glabrous	-	-	quadrangular	quadrangular	on muddy river bank	mud	-	-	-	-	-	-	-	
Lepidagathis medicaginea 	-	-	-	-	-	-	-	-	-	-	-	-	-	-	-	-	-	-	-	-	-	-	-	-	-	-	-	-	-	-	-	-	-	-	-	-	-	-	-	-	-	-	-	-	-	-	-	-	-	-	-	-	-	-	-	-	-	-	-	-	-	-	-	-	-	-	-	-	-	-	-	-	-	-	-	-	-	-	-	-	-	-	-	-	-	Capsule 	-	-	-	-	-	-	-	-	-	-	pubescent near apex with erect to flexuous, eglandular trichomes	-	glandular,trichomes	erect	-	3.2 mm long	-	-	-	-	-	-	-	-	-	-	-	-	-	-	-	-	-	-	-	-	-	-	-	-	-	-	-	     	-	-	-	-	-	-	-	-	-	-	-	lobes 	-	-	ciliate	-	ciliate	-	-	corolla 	-	white with red streaks on lower lip	-	-	red,white	-	-	-	-	-	-	4.5 mm long	-	-	-	lobes of lower lip 	-	-	-	obtuse	obtuse	-	-	-	-	-	-	-	-	-	-	2.6 mm long	cylindric	cylindric	-	-	-	-	-	-	stamens 	-	-	0.5 mm long	filaments 	-	-	-	1.9 mm long respectively	-	-	thecae 	-	0.3 mm long	apiculate at base	apiculate	glabrous	-	glabrous	3.8 mm long	-	-	-	Herb, 	-	-	-	-	-	-	-	5-15 cm tall	-	Inflorescence a |, sessile, |, |, lowermost verticillasters subtended by reduced cauline leaves; |, acuminate and fringed with long cilia at apex|, |, all fringed apically with long cilia. 	acuminate,sessile	-	-	-	-	-	red	bracteoles 	-	4 x 0.7 mm	-	-	-	-	lanceolate	lanceolate	bracts 	-	-	-	-	-	-	-	-	-	-	-	-	-	-	obovate, 	obovate	4.3 x 1.8 mm	-	-	-	-	ca. 1.2 cm long	-	-	-	-	-	-	-	-	terminal	-	terminal	-	rachis not or hardly visible, 	glabrescent towards apex	-	glabrescent	-	ovoid	ovoid	-	-	-	-	-	-	-	-	Leaves contracted into a winged petiole |, apically obtuse|, firm, |, 	obtuse,winged	-	-	blade 	-	-	-	cystoliths sometimes conspicuously lineolate on upper surface. 	-	scabrid along margin, primary vein and secondary veins (	-	-	-	-	narrowly elliptic, 	elliptic,narrow	1.5-2 x 0.4-0.8 cm	-	-	-	-	-	-	-	-	-	-	-	-	-	-	-	-	-	-	-	-	-	-	-	-	-	-	-	-	-	-	-	-	-	-	-	-	-	-	-	-	-	-	Stem |, 	-	-	young stem hirsute, especially along angles, becoming glabrescent with age	-	glabrescent,hirsute	-	-	quadrate	quadrate	-	-	-	-	-	-	-	-	-	
Lepidagathis nickeriensis 	-	-	-	-	-	-	-	-	-	-	-	-	-	-	-	-	-	-	-	-	-	-	-	-	-	-	-	-	-	-	-	-	-	-	-	-	-	-	-	-	-	-	-	-	-	-	-	-	-	-	-	-	-	-	-	-	-	-	-	-	-	-	-	-	-	-	-	-	-	-	-	-	-	-	-	-	-	-	-	-	-	-	-	-	-	Capsule 	-	-	-	-	-	-	-	-	-	-	sparsely pubescent near apex	-	-	-	-	3-4 mm long	-	-	-	-	-	-	-	-	-	-	-	-	-	-	-	-	-	-	-	-	-	-	-	-	-	-	-	     	-	-	-	-	-	-	-	-	-	-	-	-	-	-	-	-	-	-	-	corolla 	-	white with violet streaks on lower lip	-	-	violet,white	-	-	-	-	-	-	4.5 mm long	-	-	-	-	-	-	-	-	-	-	-	2.4 mm long	-	obtuse	obtuse	-	-	-	-	-	cylindric	cylindric	-	2.4 mm long	0.3 mm long	-	-	-	stamens 	-	-	-	filaments 	-	-	-	2.0 mm long respectively	-	-	thecae 	-	0.4 mm long	slightly apiculate at base	apiculate	glabrous	-	glabrous	4 mm long	-	-	-	Erect, perennial herb, 	-	-	-	-	-	-	-	15-25(-30) cm tall	-	Inflorescence of |, sessile to pedunculate, |, uninterrupted spikes, solitary or in groups and the lateral ones shorter, |, lowest verticillaster subtended by a pair of small, cauline leaves|, apically fringed with long cilia and shorter, capitate glands	capitate,sessile,short,small	-	lateral	-	-	-	-	bracteoles 	-	4.5 x 0.9 mm	fringed with cilia and glands	-	-	-	narrowly linear-lanceolate	lanceolate,linear,narrow	-	-	-	-	-	-	-	-	-	-	-	-	-	-	-	-	-	-	-	-	-	-	-	-	-	-	-	-	-	-	-	terminal	-	terminal	-	-	-	-	-	-	cylindric	cylindric	-	-	-	-	-	-	-	-	Leaves shortly petiolate or uppermost sessile, |, thin, |, 	sessile,short	thin	-	blade rhomboid, 	-	-	-	cystoliths inconspicuous; 	-	both surfaces nearly glabrous	glabrous	-	-	-	acute at apex, narrowed at base to a slender, winged petiole	acute,narrow,slender,winged	-	-	-	-	-	-	-	-	-	-	-	-	-	-	-	-	-	-	-	-	-	-	-	-	-	-	-	-	-	-	-	-	-	-	-	-	-	-	-	-	-	-	-	Stem numerous, quandrangular, narrowly winged, |, 	angular,narrow,winged	-	younger stem hispidulous, especially on the wings	-	hispidulous	-	-	-	-	in dry river beds near cataracts	-	-	-	-	-	-	-	-	
